rank,headline,sport,story_type,poll_question,poll_options,story_frame_1,story_frame_2
2,A’ja Wilson Earns Record 14th Career WNBA Western Conference Player of the Month Award,WNBA,Record / Milestone,How impressive is this milestone?,Historic / Solid but overhyped,Milestone watch: A’ja Wilson Earns Record 14th Career WNBA Western Conference Player of the Month Award,"Vote in the poll, then send us your take."
4,Reese Atwood Caps Texas Career with Back-to-Back WCWS Championships,Softball,Record / Milestone,How impressive is this milestone?,Historic / Solid but overhyped,Milestone watch: Reese Atwood Caps Texas Career with Back-to-Back WCWS Championships,"Vote in the poll, then send us your take."
5,Mirra Andreeva becomes youngest Roland Garros women’s champion since Monica Seles,Women's Sports,Record / Milestone,How impressive is this milestone?,Historic / Solid but overhyped,Milestone watch: Mirra Andreeva becomes youngest Roland Garros women’s champion since Monica Seles,"Vote in the poll, then send us your take."
6,Saint Leo wins 2026 NCAA DII softball championship,Softball,Game Recap / Result,What was the biggest takeaway from this Softball result?,Big statement / Need more proof,Quick recap: Saint Leo wins 2026 NCAA DII softball championship,"Vote in the poll, then send us your take."
7,Notre Dame Women’s basketball hires former player as assistant coach,NCAA Women's Basketball,Breaking / Transaction,Should Her Sports Daily cover this story in more detail?,Yes / No,Notre Dame Women’s basketball hires former player as assistant coach,"Vote in the poll, then send us your take."
8,Full match replay: Undefeated clay streak yields a milestone for Marta Kostyuk,Tennis,Record / Milestone,How impressive is this milestone?,Historic / Solid but overhyped,Milestone watch: Full match replay: Undefeated clay streak yields a milestone for Marta Kostyuk,"Vote in the poll, then send us your take."
9,U.S. Women's Open 2026: USGA announces purse increase to record-breaking $12.5 million,Golf / LPGA,Business / Growth,What growth story in women's sports matters most to you?,Media rights / Attendance / Investment / Sponsorship,The business of women's sports keeps growing: U.S. Women's Open 2026: USGA announces purse increase to record-breaking $12.5 million,"Vote in the poll, then send us your take."
10,"Queen's Club 411: Dates, who's playing, prize money and more",Tennis,Business / Growth,What growth story in women's sports matters most to you?,Media rights / Attendance / Investment / Sponsorship,"The business of women's sports keeps growing: Queen's Club 411: Dates, who's playing, prize money and more","Vote in the poll, then send us your take."
