post_sequence,headline,action,editorial_decision,content_family,template_name,asset_shape,timing,context_confidence,manual_review_flag,story_summary,key_fact_1,key_fact_2,key_fact_3,final_score,key_number,main_takeaway,caption,image_generation_prompt
1,"A’ja Wilson, Caitlin Clark, and Top Rookies Shatter WNBA Records 1 Month Into 2026",Make and post first,Must Post,Tonight in the W,Tonight in the W,4-slide 4:5 carousel,Post ASAP,High,No,"Indiana Fever Revokes Reporter's Credentials Over Caitlin Clark Injury Coverage Lynx Edges Valkyries 87-84, Extends Unbeaten WNBA Commissioner's Cup Run Caitlin Clark Leads Fever Over Dream to Open WNBA Commissioner's Cup Defense Aryna Sabalenka Suffers Shocking French Open 2026 Quarterfinal Collapse Chennedy Carter Calls Out Critics, Azzi Fudd After Aces Fall to Wings Records and milestones are proof points for the rise of women's sports.","Indiana Fever Revokes Reporter's Credentials Over Caitlin Clark Injury Coverage Lynx Edges Valkyries 87-84, Extends Unbeaten WNBA Commissioner's Cup Run Caitlin Clark Leads Fever Over Dream to Open WNBA Commissioner's Cup Defense Aryna Sabalenka Suffers Shocking French Open 2026 Quarterfinal Collapse Chennedy Carter Calls Out Critics, Azzi Fudd After Aces Fall to Wings Records and milestones are proof points for the rise of women's sports.","Through the first month, Minnesota rookie Olivia Miles leads all rookies in points, assists, and steals.",Fever superstar Caitlin Clark averaged 8.5 assists per game over the course of her career — that's 1.8 more than anyone in WNBA history.,87-84,87,"Through the first month, Minnesota rookie Olivia Miles leads all rookies in points, assists, and steals.","A’ja Wilson, Caitlin Clark, and Top Rookies Shatter WNBA Records 1 Month Into 2026 This is the kind of milestone that shows where the game is headed. Why it matters: Records and milestones are proof points for the rise of women's sports. Swipe through for the quick breakdown. #WomensSports #HerSportsDaily #SportsNews #WNBA #WomensBasketball","Create a 4-slide 4:5 Instagram carousel for Her Sports Daily. Template style: Tonight in the W. Sport: WNBA. Content family: Tonight in the W. Use a bold editorial women's sports aesthetic with strong hierarchy. Slide 1 headline: 'A’ja Wilson, Caitlin Clark, and Top Rookies Shatter WNBA Records 1 Month Into 2026'. Slide 2 title: 'Why it matters' with body: 'Records and milestones are proof points for the rise of women's sports.'. Slide 3 title: 'The angle' with body: 'A milestone worth putting into context.'. Slide 4 title: 'Your take?' with a short CTA to comment and follow Her Sports Daily. Use energetic sports graphic styling, matchup emphasis, strong hierarchy, top-left watermark safe zone, and clear CTA."
2,Texas wins the 2026 NCAA DI softball championship,Make and post second,Must Post,Postgame Recap,Postgame Recap Card,4-slide 4:5 carousel,Post ASAP,Medium,No,"Texas wins the 2026 NCAA DI softball championship Comprehensive up-to-date news coverage, aggregated from sources all over the world by Google News.","Texas wins the 2026 NCAA DI softball championship Comprehensive up-to-date news coverage, aggregated from sources all over the world by Google News.",Texas wins the 2026 NCAA DI softball championship NCAA.com This is timely Softball coverage with a result fans may want explained quickly.,,,,Texas wins the 2026 NCAA DI softball championship NCAA.com This is timely Softball coverage with a result fans may want explained quickly.,Texas wins the 2026 NCAA DI softball championship Here is the quick version of what happened and why it matters. Why it matters: This is timely Softball coverage with a result fans may want explained quickly. Swipe through for the quick breakdown. #WomensSports #HerSportsDaily #SportsNews #Softball #WCWS,"Create a 4-slide 4:5 Instagram carousel for Her Sports Daily. Template style: Postgame Recap Card. Sport: Softball. Content family: Postgame Recap. Use a bold editorial women's sports aesthetic with strong hierarchy. Slide 1 headline: 'Texas wins the 2026 NCAA DI softball championship'. Slide 2 title: 'Why it matters' with body: 'This is timely Softball coverage with a result fans may want explained quickly.'. Slide 3 title: 'The angle' with body: 'What happened, who stood out, and why it matters for Softball fans.'. Slide 4 title: 'Your take?' with a short CTA to comment and follow Her Sports Daily. Use recap structure, outcome first, top performer callout, and one takeaway panel."
3,Kelsey Mitchell scores 25 as Fever begin Commissioner's Cup title defense with 83-71 win over Dream,Make and post third,Maybe Post,Tonight in the W,Tonight in the W,4-slide 4:5 carousel,Post within 2 hours if still fresh,Medium,No,"Kelsey Mitchell scores 25 as Fever begin Commissioner's Cup title defense with 83-71 win over Dream Comprehensive up-to-date news coverage, aggregated from sources all over the world by Google News.","Kelsey Mitchell scores 25 as Fever begin Commissioner's Cup title defense with 83-71 win over Dream Comprehensive up-to-date news coverage, aggregated from sources all over the world by Google News.",Kelsey Mitchell scores 25 as Fever begin Commissioner's Cup title defense with 83-71 win over Dream CBS Sports This is timely WNBA coverage with a result fans may want explained quickly.,,83-71,,Kelsey Mitchell scores 25 as Fever begin Commissioner's Cup title defense with 83-71 win over Dream CBS Sports This is timely WNBA coverage with a result fans may want explained quickly.,Kelsey Mitchell scores 25 as Fever begin Commissioner's Cup title defense with 83-71 win over Dream Here is the quick version of what happened and why it matters. Why it matters: This is timely WNBA coverage with a result fans may want explained quickly. Swipe through for the quick breakdown. #WomensSports #HerSportsDaily #SportsNews #WNBA #WomensBasketball,"Create a 4-slide 4:5 Instagram carousel for Her Sports Daily. Template style: Tonight in the W. Sport: WNBA. Content family: Tonight in the W. Use a bold editorial women's sports aesthetic with strong hierarchy. Slide 1 headline: 'Kelsey Mitchell scores 25 as Fever begin Commissioner's Cup title defense with 83-71 win'. Slide 2 title: 'Why it matters' with body: 'This is timely WNBA coverage with a result fans may want explained quickly.'. Slide 3 title: 'The angle' with body: 'What happened, who stood out, and why it matters for WNBA fans.'. Slide 4 title: 'Your take?' with a short CTA to comment and follow Her Sports Daily. Use energetic sports graphic styling, matchup emphasis, strong hierarchy, top-left watermark safe zone, and clear CTA."
4,Lynx's Miles breaks Clark's WNBA rookie record with 8 3-pointers,Make if time today,Maybe Post,Tonight in the W,Tonight in the W,4-slide 4:5 carousel,Use when convenient,Medium,No,Lynx's Miles breaks Clark's WNBA rookie record with 8 3-pointers ESPN Records and milestones are proof points for the rise of women's sports.,Lynx's Miles breaks Clark's WNBA rookie record with 8 3-pointers ESPN Records and milestones are proof points for the rise of women's sports.,"Lynx's Miles breaks Clark's WNBA rookie record with 8 3-pointers Comprehensive up-to-date news coverage, aggregated from sources all over the world by Google News.",,,8,"Lynx's Miles breaks Clark's WNBA rookie record with 8 3-pointers Comprehensive up-to-date news coverage, aggregated from sources all over the world by Google News.",Lynx's Miles breaks Clark's WNBA rookie record with 8 3-pointers This is the kind of milestone that shows where the game is headed. Why it matters: Records and milestones are proof points for the rise of women's sports. Swipe through for the quick breakdown. #WomensSports #HerSportsDaily #SportsNews #WNBA #WomensBasketball,"Create a 4-slide 4:5 Instagram carousel for Her Sports Daily. Template style: Tonight in the W. Sport: WNBA. Content family: Tonight in the W. Use a bold editorial women's sports aesthetic with strong hierarchy. Slide 1 headline: 'Lynx's Miles breaks Clark's WNBA rookie record with 8 3-pointers'. Slide 2 title: 'Why it matters' with body: 'Records and milestones are proof points for the rise of women's sports.'. Slide 3 title: 'The angle' with body: 'A milestone worth putting into context.'. Slide 4 title: 'Your take?' with a short CTA to comment and follow Her Sports Daily. Use energetic sports graphic styling, matchup emphasis, strong hierarchy, top-left watermark safe zone, and clear CTA."
5,Saint Leo wins 2026 NCAA DII softball championship,Make if time today,Maybe Post,Postgame Recap,Postgame Recap Card,4-slide 4:5 carousel,Post within 2 hours if still fresh,Medium,No,"Saint Leo wins 2026 NCAA DII softball championship Comprehensive up-to-date news coverage, aggregated from sources all over the world by Google News.","Saint Leo wins 2026 NCAA DII softball championship Comprehensive up-to-date news coverage, aggregated from sources all over the world by Google News.",Saint Leo wins 2026 NCAA DII softball championship NCAA.com This is timely Softball coverage with a result fans may want explained quickly.,,,,Saint Leo wins 2026 NCAA DII softball championship NCAA.com This is timely Softball coverage with a result fans may want explained quickly.,Saint Leo wins 2026 NCAA DII softball championship Here is the quick version of what happened and why it matters. Why it matters: This is timely Softball coverage with a result fans may want explained quickly. Swipe through for the quick breakdown. #WomensSports #HerSportsDaily #SportsNews #Softball #WCWS,"Create a 4-slide 4:5 Instagram carousel for Her Sports Daily. Template style: Postgame Recap Card. Sport: Softball. Content family: Postgame Recap. Use a bold editorial women's sports aesthetic with strong hierarchy. Slide 1 headline: 'Saint Leo wins 2026 NCAA DII softball championship'. Slide 2 title: 'Why it matters' with body: 'This is timely Softball coverage with a result fans may want explained quickly.'. Slide 3 title: 'The angle' with body: 'What happened, who stood out, and why it matters for Softball fans.'. Slide 4 title: 'Your take?' with a short CTA to comment and follow Her Sports Daily. Use recap structure, outcome first, top performer callout, and one takeaway panel."
6,PWHL HAMILTON ADDS BRIANNE JENNER IN HISTORIC FIRST SIGNING,Make if time today,Maybe Post,Roster News,Roster Update Card,single 4:5 feed card,Post during daytime engagement window,Low,Yes,Reported PWHL / Women's Hockey story: PWHL HAMILTON ADDS BRIANNE JENNER IN HISTORIC FIRST SIGNING,,,,,,Reported PWHL / Women's Hockey story: PWHL HAMILTON ADDS BRIANNE JENNER IN HISTORIC FIRST SIGNING,PWHL HAMILTON ADDS BRIANNE JENNER IN HISTORIC FIRST SIGNING The next wave of talent is already changing the future. Why it matters: Recruiting and roster stories show where the next wave of stars is coming from. Swipe through for the quick breakdown. #WomensSports #HerSportsDaily #SportsNews #PWHL #WomensHockey,"Create a single 4:5 Instagram feed graphic for Her Sports Daily. Template style: Roster Update Card. Sport: PWHL / Women's Hockey. Content family: Roster News. Main headline: 'PWHL HAMILTON ADDS BRIANNE JENNER IN HISTORIC FIRST SIGNING'. Supporting line: 'Recruiting and roster stories show where the next wave of stars is coming from.'. Include a short footer CTA such as 'More women's sports daily'. Use a clean modern sports editorial look. Use athlete/program focus, breaking-update feel, and one concise why-it-matters line."
7,Dawn Staley and South Carolina Land Star Recruit Oliviyah Edwards,Save for weekend,Save for Weekend,Roster News,Roster Update Card,single 4:5 feed card,Post during daytime engagement window,High,No,Dawn Staley and South Carolina Land Star Recruit Oliviyah Edwards Dawn Staley and South Carolina Land Star Recruit Oliviyah Edwards South Carolina women's basketball coach Dawn Staley revealed how the Gamecocks landed Oliviyah Edwards after her release from Tennessee.,Dawn Staley and South Carolina Land Star Recruit Oliviyah Edwards Dawn Staley and South Carolina Land Star Recruit Oliviyah Edwards South Carolina women's basketball coach Dawn Staley revealed how the Gamecocks landed Oliviyah Edwards after her release from Tennessee.,Dawn Staley and South Carolina Land Star Recruit Oliviyah Edwards How South Carolina Basketball Coach Dawn Staley Landed 5-Star Recruit Oliviyah Edwards South Carolina women's basketball coach Dawn Staley revealed how the Gamecocks landed Oliviyah Edwards after her release from Tennessee.,"Dawn Staley and South Carolina Land Star Recruit Oliviyah Edwards Dawn Staley and South Carolina just pulled off one of the biggest wins of the NCAA women's basketball offseason , successfully recruiting five-star forward Oliviyah Edwards — the Class of 2026's No.",,,Dawn Staley and South Carolina Land Star Recruit Oliviyah Edwards How South Carolina Basketball Coach Dawn Staley Landed 5-Star Recruit Oliviyah Edwards South Carolina women's basketball coach Dawn Staley revealed how the Gamecocks landed Oliviyah Edwards after her release from Tennessee.,Dawn Staley and South Carolina Land Star Recruit Oliviyah Edwards The next wave of talent is already changing the future. Why it matters: Recruiting and roster stories show where the next wave of stars is coming from. Swipe through for the quick breakdown. #WomensSports #HerSportsDaily #SportsNews #NCAAWBB #WomensBasketball,"Create a single 4:5 Instagram feed graphic for Her Sports Daily. Template style: Roster Update Card. Sport: NCAA Women's Basketball. Content family: Roster News. Main headline: 'Dawn Staley and South Carolina Land Star Recruit Oliviyah Edwards'. Supporting line: 'Recruiting and roster stories show where the next wave of stars is coming from.'. Include a short footer CTA such as 'More women's sports daily'. Use a clean modern sports editorial look. Use athlete/program focus, breaking-update feel, and one concise why-it-matters line."
8,Serena Williams Adds 2026 Berlin Tennis Open to WTA Comeback Tour,Save for weekend,Save for Weekend,Roster News,Roster Update Card,single 4:5 feed card,Post during daytime engagement window,High,No,Serena Williams Adds 2026 Berlin Tennis Open to WTA Comeback Tour Serena Williams Adds 2026 Berlin Tennis Open to WTA Comeback Tour Tennis legend Serena Williams has signed on to play doubles at the 2026 Berlin Open after teaming up with Victoria Mboko at Queen's Club.,Serena Williams Adds 2026 Berlin Tennis Open to WTA Comeback Tour Serena Williams Adds 2026 Berlin Tennis Open to WTA Comeback Tour Tennis legend Serena Williams has signed on to play doubles at the 2026 Berlin Open after teaming up with Victoria Mboko at Queen's Club.,Serena Williams Adds 2026 Berlin Tennis Open to WTA Comeback Tour Tennis Icon Serena Williams Adds 2026 Berlin Open to WTA Comeback Tour Tennis legend Serena Williams has signed on to play doubles at the 2026 Berlin Open after teaming up with Victoria Mboko at Queen's Club.,"Serena Williams last played the Berlin Open in 2008, snapping a 17-match winning streak off a tight three-set loss to Dinara Safina. (Andreas Rentz/Bongarts/Getty Images) Serena Williams will continue her tennis comeback at the 2026 Berlin Tennis Open , adding the German WTA 500 event to her doubles schedule.",,,Serena Williams Adds 2026 Berlin Tennis Open to WTA Comeback Tour Tennis Icon Serena Williams Adds 2026 Berlin Open to WTA Comeback Tour Tennis legend Serena Williams has signed on to play doubles at the 2026 Berlin Open after teaming up with Victoria Mboko at Queen's Club.,Serena Williams Adds 2026 Berlin Tennis Open to WTA Comeback Tour The next wave of talent is already changing the future. Why it matters: Recruiting and roster stories show where the next wave of stars is coming from. Swipe through for the quick breakdown. #WomensSports #HerSportsDaily #SportsNews #WTA #Tennis,"Create a single 4:5 Instagram feed graphic for Her Sports Daily. Template style: Roster Update Card. Sport: Tennis. Content family: Roster News. Main headline: 'Serena Williams Adds 2026 Berlin Tennis Open to WTA Comeback Tour'. Supporting line: 'Recruiting and roster stories show where the next wave of stars is coming from.'. Include a short footer CTA such as 'More women's sports daily'. Use a clean modern sports editorial look. Use athlete/program focus, breaking-update feel, and one concise why-it-matters line."
