priority_score,content_bucket,sport,story_type,source,title,published,link,post_format,instagram_angle,why_it_matters,suggested_caption,hashtags,categories,summary
5,Tonight / Game Coverage,Softball,Game Preview,"""women's softball college world series when:3d"" - Google News",NCAA softball tournament: Women’s College World Series – Alabama vs Texas Tech preview - MSN,2026-06-04T09:25:19+00:00,https://news.google.com/rss/articles/CBMizwFBVV95cUxQQWFXNzhUbHNkd0VIdDNxRm42Y3pOT1VGQ2lYYVNBbFZEMW9NNW5iMEl4N2xHRHVjUnpwOUNGRk5lc0c1RE00YktYMFhLSkxSZjRmWVdVTU9oZGdDd0VIbXFGQ3MtdHNjM1ROaW53THRJT2ZWZlZ5RTJzTVlCZkhkQXVpUEhsYV8xczJMSVFVQWdveUozbUozMnhQUjVYd1AyaVl5bFkxaFZfLXdUQ2N2akgyWjhLdmkxTDNnaG4yb3ZwTkhkS3BQNGhBdTJmS2M?oc=5,Tonight graphic,"What to watch tonight in Softball, with one key player and one key matchup.",This gives followers a reason to watch Softball and can feed your pregame graphics.,Softball watchlist: NCAA softball tournament: Women’s College World Series – Alabama vs Texas Tech preview - MSN What are you watching for?,#WomensSports #HerSportsDaily #SportsNews #Softball #WCWS,,NCAA softball tournament: Women’s College World Series – Alabama vs Texas Tech preview MSN
5,Daily News,PWHL / Women's Hockey,General News,"""PWHL women's hockey when:3d"" - Google News",Sirens Protect Young Forward Core Leaving Blueline And Crease Exposed - The Hockey News,2026-06-04T09:14:24+00:00,https://news.google.com/rss/articles/CBMiqwFBVV95cUxPa1JabkVmTGhjaDRIcXBsVFNzQ1Y3anFpUUtfdEROWjFoYTBTMlk2QUNsczhDUElSNkhoc2s4blZBcTRoR3VvNzNJVDhZQUU1amJjbzBncVlfT1dla0ticDAwRU5feTFTWW9ndE5XRFlRUWF2NU5JcUM3UDZRbERaa2ZyTzE3MlpDd0xHaF9qenEtdV9vendac3JIRE5wakQwWk5SZlpmanNLdkk?oc=5,Story post,Quick hit: Sirens Protect Young Forward Core Leaving Blueline And Crease Exposed - The Hockey News,This is a useful daily update that can help keep the audience informed and consistent with the brand.,Sirens Protect Young Forward Core Leaving Blueline And Crease Exposed - The Hockey News What should we cover next?,#WomensSports #HerSportsDaily #SportsNews #PWHL #WomensHockey,,Sirens Protect Young Forward Core Leaving Blueline And Crease Exposed The Hockey News
5,Daily News,WNBA,General News,"""women's sports WNBA OR NWSL OR PWHL when:3d"" - Google News",What WNBA players have in the league’s 30th season - Fast Company,2026-06-04T08:34:26+00:00,https://news.google.com/rss/articles/CBMijwFBVV95cUxOM0xjS19fcUFMNFE1eERQMlBPWWl2VTc2QlhCU0g1ZXRvWjhRZHp2ZWxXRnJoeUdHSXZXb1ptcm5lMEo2QVpnblh0ZnBIZkRYUnNXNXVGQy0tLWpmZU1odWhGZnRnWE91NFhSQU5JM2NzeDY5TWVjVHQ4TW9RTktVcW5YRGNZR1duRjdHcno1RQ?oc=5,Story post,Quick hit: What WNBA players have in the league’s 30th season - Fast Company,This is a useful daily update that can help keep the audience informed and consistent with the brand.,What WNBA players have in the league’s 30th season - Fast Company What should we cover next?,#WomensSports #HerSportsDaily #SportsNews #WNBA #WomensBasketball,,What WNBA players have in the league’s 30th season Fast Company
5,Daily News,WNBA,General News,"""women's sports WNBA OR NWSL OR PWHL when:3d"" - Google News","Portland WNBA owners, Nike to host women’s sports summit - MSN",2026-06-04T08:30:27+00:00,https://news.google.com/rss/articles/CBMiqgFBVV95cUxOSklmd2hibmlTZklNc1hBRC13bVZKdXh4dVJXaUVITjJFdTBJZ1dXaHhleEpYcGdLOUhLdlNRTmpuQmJGNjVFakxGT3FXRGZkQS1RODZTeU4tdHMzSVMtMVRwZlVrd1YyaGxnTnJ4UmdDZWhuRGNqZDFYT2dBRlhSRF9TRlUwbU9fTDZBNlZjMjQ1WVFGREY0Ykw3V2c5ZGJoRGVJbWE3WVFsZw?oc=5,Story post,"Quick hit: Portland WNBA owners, Nike to host women’s sports summit - MSN",This is a useful daily update that can help keep the audience informed and consistent with the brand.,"Portland WNBA owners, Nike to host women’s sports summit - MSN What should we cover next?",#WomensSports #HerSportsDaily #SportsNews #WNBA #WomensBasketball,,"Portland WNBA owners, Nike to host women’s sports summit MSN"
5,College Spotlight,NCAA Women's Basketball,Injury / Availability,"""women's college basketball NCAA when:3d"" - Google News","Notre Dame legend Muffet McGraw talks state of NCAA, politics and more - South Bend Tribune",2026-06-04T08:00:00+00:00,https://news.google.com/rss/articles/CBMi7wFBVV95cUxNRjlmYWp1VWZKRTBPVW12Q3IwbDNoc3VGN3pYV3EzTVZoYkcxN3JzanIwanRtSThyckFHaTQwUDBQdG5iZFBRWGNNejJ1engwdUdMRFJDaVFFaDdNSzN0VnF1dmpCQy02Wm5zTWk2T1pmbVhFZlI1NHFHSTNnOFZxTmZrRTlCZ1hfUloyQXUtUUpHQ1JYWFA2bG1NbDJRT3VZMFdfNldJSUZsSmNROGR5VVVBUXJGZkh1MDdoMXZtaXp0dGNOdGlGdHgzbk9RWHp5bW9OMEJaVUt2dEtkdU1DNFptWDVwY0VjOS1zbUNRbw?oc=5,Story post,"Quick hit: Notre Dame legend Muffet McGraw talks state of NCAA, politics and more - South Bend Tribune",This is a useful daily update that can help keep the audience informed and consistent with the brand.,"Notre Dame legend Muffet McGraw talks state of NCAA, politics and more - South Bend Tribune What should we cover next?",#WomensSports #HerSportsDaily #SportsNews #NCAAWBB #WomensBasketball,,"Notre Dame legend Muffet McGraw talks state of NCAA, politics and more South Bend Tribune"
5,Tonight / Game Coverage,Golf / LPGA,Game Preview,"""LPGA women's golf when:3d"" - Google News","U.S. Women’s Open 2026: How to watch, TV schedule, stream information - Golf Channel",2026-06-04T07:00:00+00:00,https://news.google.com/rss/articles/CBMisAFBVV95cUxOSi01V1AzNjVjWktQYUVoZ2lNS2dGdE93WUpfd3VMenFaLWw2UDlIbWxYUVR5LWd6elMxd2tiLUFTaUducG1tUXRJMEt1MHU5ZXFtdTVWdlM2cGE1UmktbDg3dTZzUnhWb0xGeFRNVl9ISDJGRk1MZmFVTjdWM2NjQ0w3eU5tNnltZmltd2J2Rl9xcWhQV2J2S0IwRUxTdjdILVFxZ3NSdHltZjdJWk1BaQ?oc=5,Tonight graphic,"What to watch tonight in Golf / LPGA, with one key player and one key matchup.",This gives followers a reason to watch Golf / LPGA and can feed your pregame graphics.,"Golf / LPGA watchlist: U.S. Women’s Open 2026: How to watch, TV schedule, stream information - Golf Channel What are you watching for?",#WomensSports #HerSportsDaily #SportsNews #LPGA #Golf,,"U.S. Women’s Open 2026: How to watch, TV schedule, stream information Golf Channel"
5,Daily News,NWSL / Women's Soccer,Injury / Availability,"""USWNT women's soccer when:3d"" - Google News","Arne Slot needs a job and, in the Netherlands, one role is beginning to stand out - The Athletic - The New York Times",2026-06-04T06:10:22+00:00,https://news.google.com/rss/articles/CBMijwFBVV95cUxOeExRODlrbDhhN0h1N3p4MEFfNkF5c25iaVZHclo5c21YQUlXZ3R2UksweG9aejFEV0pFSkVfV3lIa2Q1Y2ZqV1l3bktSU3NRaUNLMm9POGptT1NXdGVJQnE3MEZVQllOajk2ME13czJmay1fQTlnNmIwaFZxZktsU00xRFJsSGhPNHNJa2RpUQ?oc=5,Story post,"Quick hit: Arne Slot needs a job and, in the Netherlands, one role is beginning to stand out - The Athletic - The New York Times",This is a useful daily update that can help keep the audience informed and consistent with the brand.,"Arne Slot needs a job and, in the Netherlands, one role is beginning to stand out - The Athletic - The New York Times What should we cover next?",#WomensSports #HerSportsDaily #SportsNews #NWSL #USWNT #WomensSoccer,,"Arne Slot needs a job and, in the Netherlands, one role is beginning to stand out - The Athletic The New York Times"
5,Daily News,NWSL / Women's Soccer,General News,"""NWSL women's soccer when:3d"" - Google News",Knicks fans come to their feet at MSG - The New York Times,2026-06-04T02:39:00+00:00,https://news.google.com/rss/articles/CBMiZkFVX3lxTE5DUlJLM3hDbWZhemo4WUxhTEJyOGhCTzBJSEZMQ3hFdDRKdWt2QXFKckh6STFCVHhmSjc1ZklCaUE2WFFsSVcyQ0FFQXV1N1hMUDZOcEw4aEV3YUZxQU83NDhoelNZUQ?oc=5,Story post,Quick hit: Knicks fans come to their feet at MSG - The New York Times,This is a useful daily update that can help keep the audience informed and consistent with the brand.,Knicks fans come to their feet at MSG - The New York Times What should we cover next?,#WomensSports #HerSportsDaily #SportsNews #NWSL #USWNT #WomensSoccer,,Knicks fans come to their feet at MSG The New York Times
5,Daily News,PWHL / Women's Hockey,General News,"""PWHL women's hockey when:3d"" - Google News",Detroit PWHL team names Michigan native Josh Sciba head coach - AOL.com,2026-06-04T01:29:30+00:00,https://news.google.com/rss/articles/CBMifEFVX3lxTE9zdzZPZ0F5N0FXZk5tWXJwQktPdmlqT2Z6LUxvNjB2dTFkT3E1VTlWb3lRVGtuYWdfNmtiWTg4UG52WnVJMGtwN2tDX0ZBNVJ0djZoclhhelJWU0FybEJadDBiV2RSN0J4cko1cnNPcDFjSWpuaFB1c1pNSjI?oc=5,Story post,Quick hit: Detroit PWHL team names Michigan native Josh Sciba head coach - AOL.com,This is a useful daily update that can help keep the audience informed and consistent with the brand.,Detroit PWHL team names Michigan native Josh Sciba head coach - AOL.com What should we cover next?,#WomensSports #HerSportsDaily #SportsNews #PWHL #WomensHockey,,Detroit PWHL team names Michigan native Josh Sciba head coach AOL.com
5,Daily News,NWSL / Women's Soccer,General News,"""NWSL women's soccer when:3d"" - Google News",Knicks fans react to KAT's hard fall - The New York Times,2026-06-04T01:28:02+00:00,https://news.google.com/rss/articles/CBMiZkFVX3lxTFBoOTlINlZlelg2RTJYdmJaeElTTk92VGVlVkZtSnRZTGJvUWlMRGQ1YW5rdndtYjlsdXFaR21oc3BUcWhzdkU4TFlKaVY3cTg2SUd2V2R0cUhJay1xcEp6SXYwUFFudw?oc=5,Story post,Quick hit: Knicks fans react to KAT's hard fall - The New York Times,This is a useful daily update that can help keep the audience informed and consistent with the brand.,Knicks fans react to KAT's hard fall - The New York Times What should we cover next?,#WomensSports #HerSportsDaily #SportsNews #NWSL #USWNT #WomensSoccer,,Knicks fans react to KAT's hard fall The New York Times
5,Daily News,NWSL / Women's Soccer,General News,"""USWNT women's soccer when:3d"" - Google News","Rodman, Wilson and Swanson are together again for USWNT matches against Brazil - MSN",2026-06-04T01:15:16+00:00,https://news.google.com/rss/articles/CBMiyAFBVV95cUxNQ0l5NmhjczRiTFFUdE43YVZlQzBhTjRndXFNMWtiU1NEd2dUejR4dTFkN0I1U2ZoNm5XR25JMjM0OTh4d1ZiS0tDNFJHd3hqaDhlUk9USjRTSjNtck5aVE1RS2hFTVB5b0ZkdGxHVTREclN5RUxRNlgzbVZhekVvY2J0S3AwczBZcnloclRjVkd3TkkzQlIwVFJCUzBySmdTLXltS01Sa2N0WUoxSXQzRDVLTHZPX2kybU1JU3pFWlZ0eEtqbkZHMg?oc=5,Story post,"Quick hit: Rodman, Wilson and Swanson are together again for USWNT matches against Brazil - MSN",This is a useful daily update that can help keep the audience informed and consistent with the brand.,"Rodman, Wilson and Swanson are together again for USWNT matches against Brazil - MSN What should we cover next?",#WomensSports #HerSportsDaily #SportsNews #NWSL #USWNT #WomensSoccer,,"Rodman, Wilson and Swanson are together again for USWNT matches against Brazil MSN"
5,Daily News,WNBA,Injury / Availability,"""women's sports WNBA OR NWSL OR PWHL when:3d"" - Google News",WNBA stars receive major backing from Shaquille O’Neal - Rolling Out,2026-06-04T01:14:00+00:00,https://news.google.com/rss/articles/CBMigAFBVV95cUxQS0lvS2l3UFZuajlrc29jaTBUTTlBSlZqTS1GN0psS2hIRWxzdXlrUEM2cFdVaHl5ZHdEaGtHWG9NZTA1VWJVRk43M2JEMjRpT2lRVlFEaW83QTNJdFc3eHBGOElRZGJlQUZwczFxa1o3dTEtTDFqRVphUE1vdnUzaA?oc=5,Story post,Quick hit: WNBA stars receive major backing from Shaquille O’Neal - Rolling Out,This is a useful daily update that can help keep the audience informed and consistent with the brand.,WNBA stars receive major backing from Shaquille O’Neal - Rolling Out What should we cover next?,#WomensSports #HerSportsDaily #SportsNews #WNBA #WomensBasketball,,WNBA stars receive major backing from Shaquille O’Neal Rolling Out
5,Daily News,NWSL / Women's Soccer,General News,"""NWSL women's soccer when:3d"" - Google News",10 NWSL Players to Watch This International Break | News - NWSL,2026-06-04T00:19:33+00:00,https://news.google.com/rss/articles/CBMiiAFBVV95cUxPS01sZGN4UGRUV1ZLVDV6X1BuRnZva0dhUVlMWGZKS1NWVnVRT1BfeXFwdnhTNFN1SE93bE8wZ0gzUVZRVDdwREFBY3RuUGdMVTlkNDVFNDl1YUc1amZUUnFLenQwRmJLWU1EVU9GRlJuRGMxM3Vhd2VvcGJHZUk1T2NBa3E4SXZT?oc=5,Story post,Quick hit: 10 NWSL Players to Watch This International Break | News - NWSL,This is a useful daily update that can help keep the audience informed and consistent with the brand.,10 NWSL Players to Watch This International Break | News - NWSL What should we cover next?,#WomensSports #HerSportsDaily #SportsNews #NWSL #USWNT #WomensSoccer,,10 NWSL Players to Watch This International Break | News NWSL
5,College Spotlight,Softball,Awards / Rankings,"""women's college basketball NCAA when:3d"" - Google News",Ranking the best college softball players who plan to enter 2026 transfer portal - USA Today,2026-06-03T23:57:00+00:00,https://news.google.com/rss/articles/CBMiygFBVV95cUxQTmphRU9aMnhEZ1FGNENDZ0d3MGN1VGVSUjNOTEhZRW5Gcmkxc2xNYjRsNTAzZDlIbmgzVDJyZmlwM0ZNcEhXYzlqbHBrTExjekdUcHdDTTNiR1pPN3pQVWpsT0thekh6NHZWaVpkdWJGdEkzZjFuQVR3QjJpRkVpWjhNazFDNzZPNENFQUdvbV9Yb3BoN3hSMXozUndSaE04cWx3YmZCb0FFd2g4RUVnak1lbm1yNzdkSGszVGtDZWo4ZWs2bUE3RWpR?oc=5,Single graphic,Quick hit: Ranking the best college softball players who plan to enter 2026 transfer portal - USA Today,This is a useful daily update that can help keep the audience informed and consistent with the brand.,Ranking the best college softball players who plan to enter 2026 transfer portal - USA Today What should we cover next?,#WomensSports #HerSportsDaily #SportsNews #Softball #WCWS,,Ranking the best college softball players who plan to enter 2026 transfer portal USA Today
5,Tonight / Game Coverage,Softball,Game Preview,"""women's softball college world series when:3d"" - Google News","What channel is Texas softball vs Texas Tech on today? Time, TV schedule for WCWS Game 1 - The Oklahoman",2026-06-03T23:32:00+00:00,https://news.google.com/rss/articles/CBMi_wFBVV95cUxNNXFaMDlhVEk1YzBOcVgzUzNHeU9FejZ2MWgtMFowa2FvbHBnbGU4Skdpb1FVNFRlRnBHRGVRMnJWTHBuc0w2UlJzaG1teU5jV3hwWlVibUg0TFVPdEpYeXFjNXFqeFhsdWRVamt1eGV4dlZWa2lCamRYV0ozRlZSYTliaG9NOU5wOENmUGlIbnJSNFFUb3RoUzhYUHB2VEJ5UVFFWlgzdjc4SXRod3dfZWI4dE1uZWhBWlFnU2Z1RUNTRXVBaEhKNkRCd1pRcjd0WDNheldydTFVbjZIYldqM0k2c21lYTg1VTZuaExYSTlIWnZHQ3o1N3FieFRoc0k?oc=5,Tonight graphic,"What to watch tonight in Softball, with one key player and one key matchup.",This gives followers a reason to watch Softball and can feed your pregame graphics.,"Softball watchlist: What channel is Texas softball vs Texas Tech on today? Time, TV schedule for WCWS Game 1 - The Oklahoman What are you watching for?",#WomensSports #HerSportsDaily #SportsNews #Softball #WCWS,,"What channel is Texas softball vs Texas Tech on today? Time, TV schedule for WCWS Game 1 The Oklahoman"
5,Daily News,NWSL / Women's Soccer,General News,"""NWSL women's soccer when:3d"" - Google News",Triple Espresso reunites at USWNT camp in Brazil | The IX Soccer - The IX Sports,2026-06-03T23:29:34+00:00,https://news.google.com/rss/articles/CBMihwFBVV95cUxNWWhsUWlhMUJ0OVBWTEhxVDF5N1VFQlM2cnZsQm15RHVjT2VyekR3SDhmQVFnSzNXYkE3eWJBM0tsRTEwd0hLZmtMc0FyY0FvVFNJODJzNHZmR3ZnUThxQ3BmMDUzSi01NFVtVEZGSVJHdmxmRFVXQ2tLR0NadUEyakl4TmhhYjA?oc=5,Story post,Quick hit: Triple Espresso reunites at USWNT camp in Brazil | The IX Soccer - The IX Sports,This is a useful daily update that can help keep the audience informed and consistent with the brand.,Triple Espresso reunites at USWNT camp in Brazil | The IX Soccer - The IX Sports What should we cover next?,#WomensSports #HerSportsDaily #SportsNews #NWSL #USWNT #WomensSoccer,,Triple Espresso reunites at USWNT camp in Brazil | The IX Soccer The IX Sports
5,Daily News,NWSL / Women's Soccer,General News,"""USWNT women's soccer when:3d"" - Google News","Rodman, Wilson and Swanson are together again for USWNT matches against Brazil - Toronto Star",2026-06-03T22:32:30+00:00,https://news.google.com/rss/articles/CBMi-AFBVV95cUxPb3ZGa193STk2aWhDSFR1ZFhBbVpZeExsbWJSZXc4VUlrMXdEQUhJbzN5cHhNdjVRTW1LUElFa0hrbWtjWVpXVnJjbDNHNUlHU3VvbGZPTTZlQ0JvRzZTckdVbVY1OHRKR0F2U09vbjk0aTU5OEJFMkdaaXBCRk9yYmNXMmlPYWg2YlQ4bGxwWW5EcDM0d2R5MWt5NHV4OG1tUWVNSjFwOWp4dS13eWtTYkR3VnMzS2JnZUVid082cEY4Ti1NSUZubFRaOEFIMmFwc0VfaHdLOXl5Rm40LXFyVXVZLVJZWV8tb1hjWThiN21LaE5qbDYzSQ?oc=5,Story post,"Quick hit: Rodman, Wilson and Swanson are together again for USWNT matches against Brazil - Toronto Star",This is a useful daily update that can help keep the audience informed and consistent with the brand.,"Rodman, Wilson and Swanson are together again for USWNT matches against Brazil - Toronto Star What should we cover next?",#WomensSports #HerSportsDaily #SportsNews #NWSL #USWNT #WomensSoccer,,"Rodman, Wilson and Swanson are together again for USWNT matches against Brazil Toronto Star"
5,Daily News,PWHL / Women's Hockey,General News,"""PWHL women's hockey when:3d"" - Google News",EPISODE 22 with SARA SWIDERSKI - Professional Women's Hockey League (PWHL),2026-06-03T22:29:41+00:00,https://news.google.com/rss/articles/CBMickFVX3lxTFBVTS1HS0VSV1pyRElxbDhrSE9Lc3ZtWnBCbEtaMlR0UlpucHRSdkhHRTk1ZjFKaGlEcUE5TWZRZVBnSzdGNlJ0eXNCREREYUpqekJvSjJsRE1TV3lzazZrREEwX01sN3E5ZTl5dldadkZtZw?oc=5,Story post,Quick hit: EPISODE 22 with SARA SWIDERSKI - Professional Women's Hockey League (PWHL),This is a useful daily update that can help keep the audience informed and consistent with the brand.,EPISODE 22 with SARA SWIDERSKI - Professional Women's Hockey League (PWHL) What should we cover next?,#WomensSports #HerSportsDaily #SportsNews #PWHL #WomensHockey,,EPISODE 22 with SARA SWIDERSKI Professional Women's Hockey League (PWHL)
5,Daily News,NWSL / Women's Soccer,General News,"""USWNT women's soccer when:3d"" - Google News","Rodman, Wilson and Swanson are together again for USWNT matches against Brazil - The Killeen Daily Herald",2026-06-03T22:29:18+00:00,https://news.google.com/rss/articles/CBMi8wFBVV95cUxQMTlIV3ZjN0luQjVBMmk5Tm9nY09oaUxicGowamJiZTFaSkJGWXYzczdqal83UkRZQ0VXR2FuV193bE81X1pYa1NQaVk5U2FVRFB4TTZEWjNlQ0JnMjZTRzFsSE1ZNlJYekhOOXlqM0RlMjVVVDB6VklncTFVdl9nQ0RHYzhHbWEzN0piakJqTU1lYjlYVHJHcFhmWFV4VE1YTzVEY3JiUE96Tm1oRDJRc3B3aVVoU2hQQVd2dlZmYUQ1VTZocFNET2dhLVcyUU1BekEtblJkYWRQODBHNVJUN1ZSbld2Yi1CRlZSdE12NllTZVk?oc=5,Story post,"Quick hit: Rodman, Wilson and Swanson are together again for USWNT matches against Brazil - The Killeen Daily Herald",This is a useful daily update that can help keep the audience informed and consistent with the brand.,"Rodman, Wilson and Swanson are together again for USWNT matches against Brazil - The Killeen Daily Herald What should we cover next?",#WomensSports #HerSportsDaily #SportsNews #NWSL #USWNT #WomensSoccer,,"Rodman, Wilson and Swanson are together again for USWNT matches against Brazil The Killeen Daily Herald"
5,Daily News,NWSL / Women's Soccer,General News,"""USWNT women's soccer when:3d"" - Google News","Rodman, Wilson and Swanson are together again for USWNT matches against Brazil - Bozeman Daily Chronicle",2026-06-03T22:29:18+00:00,https://news.google.com/rss/articles/CBMijAJBVV95cUxPZGdVVVQ5MzVlZVIyT3B6azFpYXZpSV92NmJuUXJ5ZEVqaHFERXhoTjlPdTItbzYtUVZvRXBJRTEzSjZMemZZaEhSZDBZSzdmVEZfZmZtci1renI5Mmc1bUVjZmZtYkR3Sm5zN3F6c05PaC1GQjd2WVI3TkZ1d0E2dWhuNmlYbDlSY0p2dlBaX25fcEV4TWNxZEdWUE1jY2ktMVI1NFJvSVBENzFqV0hNaF8zTk9oMGxtWkIzdm5WdnpFT3dyMnJPSjJWdUtqczZkSGZkVFY3bWVua25ySlkzMFFzamM4QXcwMTYyb0cxY2xONEZRNm1sWFVkX0dsZURpc1dmQy15bFhzUnlS?oc=5,Story post,"Quick hit: Rodman, Wilson and Swanson are together again for USWNT matches against Brazil - Bozeman Daily Chronicle",This is a useful daily update that can help keep the audience informed and consistent with the brand.,"Rodman, Wilson and Swanson are together again for USWNT matches against Brazil - Bozeman Daily Chronicle What should we cover next?",#WomensSports #HerSportsDaily #SportsNews #NWSL #USWNT #WomensSoccer,,"Rodman, Wilson and Swanson are together again for USWNT matches against Brazil Bozeman Daily Chronicle"
5,Daily News,NWSL / Women's Soccer,General News,"""USWNT women's soccer when:3d"" - Google News","Rodman, Wilson and Swanson are together again for USWNT matches against Brazil - Oskaloosa Herald",2026-06-03T22:29:18+00:00,https://news.google.com/rss/articles/CBMihwJBVV95cUxNMVhCRkJ5OTB4STJZQ3AxMVpUSEQ2dGlrRzVhUlBXWnNobWZhREJxU0h0X1dDTXA3UU5kLXRVcmY0aGhqWlFiWlJ3OUU0bTJaMVZhNS1YSjVHTENiOXBCeXVPRTlaemM2R1kyUkk0Q0tidV90V29CeENxRE53dTIzX0ZhVGV5V1lLRGh4enJCOEd3Q3FHUTNkQ0w3WEJFSXpRNG92OUJtS2lNWkRWOTNrUE9XYi1oMVBKZ0h1WHFjTzZncWhkVURUaWdNYm1ReExoZXE5QlpyYWxwSHFSdWF0VlN4elJ0ZF9Zekh2QkhOT3kzdFJSZnJjc2dsODhLNHNZREhLZzNPaw?oc=5,Story post,"Quick hit: Rodman, Wilson and Swanson are together again for USWNT matches against Brazil - Oskaloosa Herald",This is a useful daily update that can help keep the audience informed and consistent with the brand.,"Rodman, Wilson and Swanson are together again for USWNT matches against Brazil - Oskaloosa Herald What should we cover next?",#WomensSports #HerSportsDaily #SportsNews #NWSL #USWNT #WomensSoccer,,"Rodman, Wilson and Swanson are together again for USWNT matches against Brazil Oskaloosa Herald"
5,Daily News,NWSL / Women's Soccer,General News,"""USWNT women's soccer when:3d"" - Google News","Rodman, Wilson and Swanson are together again for USWNT matches against Brazil - cecildaily.com",2026-06-03T22:29:18+00:00,https://news.google.com/rss/articles/CBMigAJBVV95cUxQbmgtTjJnZ2FWNWNqU2ljYk1DRW1taWc3RE41VFJrVFgzclZNZlV2dzNjVGRCUHFqZGpJMS1wS3ZnS1BzMm9CR09qUGphVWRubjdhRU5FdFVzWjg5M0N3bDFiRlRrWi1qWlpfZ3BYYmp1SGg4Q2ROTmZSclJmcDVKVG9qRlR0ZU0tTDFQbDJrUFhWUFdEUEtBeVBFUU4ycUNkbTE3QTlhR25nSXExODd2R3FvYVJyWXU4Zm0yWlZZem82ZXBhbU1wU3dlMmt0Z2lYT01YSWFhZ0dKWUJrWjdUSU16TmF6LUg1WllKdXFFZlpYM2xkc0NZLS1rdmNqd3dU?oc=5,Story post,"Quick hit: Rodman, Wilson and Swanson are together again for USWNT matches against Brazil - cecildaily.com",This is a useful daily update that can help keep the audience informed and consistent with the brand.,"Rodman, Wilson and Swanson are together again for USWNT matches against Brazil - cecildaily.com What should we cover next?",#WomensSports #HerSportsDaily #SportsNews #NWSL #USWNT #WomensSoccer,,"Rodman, Wilson and Swanson are together again for USWNT matches against Brazil cecildaily.com"
5,Daily News,NWSL / Women's Soccer,General News,"""USWNT women's soccer when:3d"" - Google News","Rodman, Wilson and Swanson are together again for USWNT matches against Brazil - Indiana Gazette Online",2026-06-03T22:29:00+00:00,https://news.google.com/rss/articles/CBMi-AFBVV95cUxNd2dKSXRMVUFDdGlLUXJLVF9LVUQ1ZzRXd0RxUTdqZUV0RFVRSHRsSG5NUFk5d2xkRXlyMVdKdk02RUxnUHVCdjVqMEFzV0w2ODlzc2NzeTR4dlZiYVZRMngzZ1l5TEs2dnQzUVB4Q0ZwSDRKTlNZblVHQ2Z1ZnR0NUJwazVDU3l3TzByNTFxZi1kVlY5bldxeDhCS2Npd0tUSUJGeVNQU0dmempxaF9yTlI5Snkya0twajFrb2JLVFdwSHVuLWFqdUdnV1VSU1VxeldkNElQWnM3VXlYMlBSLVdNbnVKdWhRcmxBYms0dFpBS2hCOWQwOA?oc=5,Story post,"Quick hit: Rodman, Wilson and Swanson are together again for USWNT matches against Brazil - Indiana Gazette Online",This is a useful daily update that can help keep the audience informed and consistent with the brand.,"Rodman, Wilson and Swanson are together again for USWNT matches against Brazil - Indiana Gazette Online What should we cover next?",#WomensSports #HerSportsDaily #SportsNews #NWSL #USWNT #WomensSoccer,,"Rodman, Wilson and Swanson are together again for USWNT matches against Brazil Indiana Gazette Online"
5,Daily News,PWHL / Women's Hockey,General News,"""PWHL women's hockey when:3d"" - Google News",TORONTO SCEPTRES RE-SIGN AND PROTECT RAYGAN KIRK AHEAD OF 2026-27 SEASON - Professional Women's Hockey League (PWHL),2026-06-03T22:25:57+00:00,https://news.google.com/rss/articles/CBMi1wFBVV95cUxPZ3RqWjdWXzZmTjV4Snk3V2JfMWFwdHdmaWJzT0NBNkhPbXBaNUVMTlk1R1RnaEFQdTBkQmdHSHJhb1JySnFnVXppcWhOS200RU5pMGJMX1BnODIzcTM5Nm94T1NkYVBhOTlhaTBWYldnVVVCV08xZ0pDR0lBZDcxeVpqZzlzaWJsNDQyUEVRRl9oNjNGSGFnRS1MN2tscG4zZlpLZ0VJNHVoZTlqbXhkVFVjSWRjMGhSOVpiTXF0WW91Qml2ZENPWWg2ZXpEWEtjaThEU0o1WQ?oc=5,Story post,Quick hit: TORONTO SCEPTRES RE-SIGN AND PROTECT RAYGAN KIRK AHEAD OF 2026-27 SEASON - Professional Women's Hockey League (PWHL),This is a useful daily update that can help keep the audience informed and consistent with the brand.,TORONTO SCEPTRES RE-SIGN AND PROTECT RAYGAN KIRK AHEAD OF 2026-27 SEASON - Professional Women's Hockey League (PWHL) What should we cover next?,#WomensSports #HerSportsDaily #SportsNews #PWHL #WomensHockey,,TORONTO SCEPTRES RE-SIGN AND PROTECT RAYGAN KIRK AHEAD OF 2026-27 SEASON Professional Women's Hockey League (PWHL)
5,Daily News,WNBA,General News,"""women's sports WNBA OR NWSL OR PWHL when:3d"" - Google News",2026-27 PWHL Roster Tracker | The IX Hockey | Powered by The Ice Garden - The IX Sports,2026-06-03T22:07:14+00:00,https://news.google.com/rss/articles/CBMiggFBVV95cUxQMGFNRF9nT2doOUNfUlVJcF9BR2ZtYTB3enM0OTMxaU5xbUhJWHd3bFdVSlY4cmRJeFFTWFZ4UWtFeERBcmVsU1JmWmlqTmprZWc1WXh2QzR1c2VCRnlKR1BTTHV0YkMwUHZ2T1pESEh0dldsWVZMVVN5dF9wZ2QyUG9R?oc=5,Story post,Quick hit: 2026-27 PWHL Roster Tracker | The IX Hockey | Powered by The Ice Garden - The IX Sports,This is a useful daily update that can help keep the audience informed and consistent with the brand.,2026-27 PWHL Roster Tracker | The IX Hockey | Powered by The Ice Garden - The IX Sports What should we cover next?,#WomensSports #HerSportsDaily #SportsNews #WNBA #WomensBasketball,,2026-27 PWHL Roster Tracker | The IX Hockey | Powered by The Ice Garden The IX Sports
5,Tonight / Game Coverage,Softball,Game Preview,"""women's softball college world series when:3d"" - Google News","Women's College World Series free live streams, schedule to watch Texas vs. Texas Tech softball without cable - Yahoo Sports",2026-06-03T22:07:01+00:00,https://news.google.com/rss/articles/CBMiiAFBVV95cUxOTTBhRWlndUItVWs3MVNRVldkdUJPc2s4TEdIUzYzNW5JQXR4NDR5aVV5QndEc1pWMGxmbjVzZ3Q2Q05YNXlvWnRWN3VualBRZ2VEWC1WVHZvdGJsbTl2NW1kWjhMU2tLczNpOXQyWTFQYkdnYVZhZjgxMWxHeEc3UDZILWlMX1gy?oc=5,Tonight graphic,"What to watch tonight in Softball, with one key player and one key matchup.",This gives followers a reason to watch Softball and can feed your pregame graphics.,"Softball watchlist: Women's College World Series free live streams, schedule to watch Texas vs. Texas Tech softball without cable - Yahoo Sports What are you watching for?",#WomensSports #HerSportsDaily #SportsNews #Softball #WCWS,,"Women's College World Series free live streams, schedule to watch Texas vs. Texas Tech softball without cable Yahoo Sports"
