priority_score,content_bucket,sport,story_type,source,title,published,link,post_format,instagram_angle,why_it_matters,suggested_caption,hashtags,categories,summary
6,Tonight / Game Coverage,WNBA,Game Preview,"""women's sports WNBA OR NWSL OR PWHL when:3d"" - Google News","WNBA games today: Schedule, times, how to watch for June 3 - USA Today",2026-06-03T11:13:00+00:00,https://news.google.com/rss/articles/CBMirwFBVV95cUxNOHpwX2Zkc19fb3FVNWxDbC03MWRzVUE5UF8zQ1Z1dlZ5YjRxNmxiWHVnSmtHMVE3WThiYmhGczVfblFOQ3dWdlJ3MjVHSmh4YzRJTWh2UTkwdUc3cHp3NFJQenRhNzYxZDhkZER2bzd5UW1CeXJ1WmM4S3RCRjd4cjFNQzZiaVB2Uk5jazl3XzBOZVJqLXAwODZrSVhpSkFWbjFwVDRZcmpOQWlzbHI0?oc=5,Tonight graphic,"What to watch tonight in WNBA, with one key player and one key matchup.",This gives followers a reason to watch WNBA and can feed your pregame graphics.,"WNBA watchlist: WNBA games today: Schedule, times, how to watch for June 3 - USA Today What are you watching for?",#WomensSports #HerSportsDaily #SportsNews #WNBA #WomensBasketball,,"WNBA games today: Schedule, times, how to watch for June 3 USA Today"
6,Culture & Impact,PWHL / Women's Hockey,Player Profile,"""PWHL women's hockey when:3d"" - Google News",First woman to appear in NHL game continues to build legacy as a PWHL general manager - Toronto Star,2026-06-03T11:00:03+00:00,https://news.google.com/rss/articles/CBMigwJBVV95cUxOUWZ4cElHTERtMkdBQ1I3LVdzSDlaV1BjSHg3ekdGLWpzbk1tUlc4dFh3OUxFc004Y0FqUk45a3U3d1dWbTBOOExhMC16WUxKMi1wa2tZTjNnRm5aMkFza1A0clZqSDFneV9FQVF0cVZTUFJCZWlDcDZ5MDVMNmN5Z0pKWjNoVUVaUlNJbTkxaGo0d3VzS3A3TDFiSVZ5ZG0xTHRGYU9lOFJrT0lPeHJZOUh1RzNsVGlYV3NLX0J0Nkd0c1M2REFVM20zSHI0b0NRV2h5TWFTRURYYUVISzdHSURQZ2FKR2RaRkNOZTBkV1RTQlhBWTl5WDdEREhKUDhKc2g0?oc=5,Reel or story feature,The athlete story behind the headline.,This is a useful daily update that can help keep the audience informed and consistent with the brand.,First woman to appear in NHL game continues to build legacy as a PWHL general manager - Toronto Star What should we cover next?,#WomensSports #HerSportsDaily #SportsNews #PWHL #WomensHockey,,First woman to appear in NHL game continues to build legacy as a PWHL general manager Toronto Star
6,Tonight / Game Coverage,NWSL / Women's Soccer,Game Preview,"""USWNT women's soccer when:3d"" - Google News",Where to watch USWNT soccer today? Live stream & TV channel for upcoming games - Goal.com,2026-06-03T09:01:15+00:00,https://news.google.com/rss/articles/CBMiigFBVV95cUxQcjlEeGVFblRBYmRpc0tKYkdnS0ZYSVgyOVkySVBQSVBHektHMzhfc0dCS1FyNVdTZm1vYXhza1Fha3RHSGZFeTFHVmNVQjNPcU1CcWkycG9TM2pxYmtOcEQtdGJwOUxUTm9YZnl3ZzFGaWEzN2xmdzFxdGFSWVRXd2d3WWxHQWxrWVE?oc=5,Tonight graphic,"What to watch tonight in NWSL / Women's Soccer, with one key player and one key matchup.",This gives followers a reason to watch NWSL / Women's Soccer and can feed your pregame graphics.,NWSL / Women's Soccer watchlist: Where to watch USWNT soccer today? Live stream & TV channel for upcoming games - Goal.com What are you watching for?,#WomensSports #HerSportsDaily #SportsNews #NWSL #USWNT #WomensSoccer,,Where to watch USWNT soccer today? Live stream & TV channel for upcoming games Goal.com
6,Tonight / Game Coverage,WNBA,Game Preview,"""women's sports WNBA OR NWSL OR PWHL when:3d"" - Google News",2026 WNBA Schedule 30/08/2026 - The Athletic - The New York Times,2026-06-03T06:36:25+00:00,https://news.google.com/rss/articles/CBMiakFVX3lxTFBvXzVDa2xaVHBRTWpoYjNVZ0ozLTVBZVR3ZEd1RURvT3pEMjBNX2lRTzJpQWZvWkllNnF4LWs2WThGeF9FNTcwTS1iVURQZ2diY0FITERJMGJUN1hJajJiVUNfZURMeS1UVXc?oc=5,Tonight graphic,"What to watch tonight in WNBA, with one key player and one key matchup.",This gives followers a reason to watch WNBA and can feed your pregame graphics.,WNBA watchlist: 2026 WNBA Schedule 30/08/2026 - The Athletic - The New York Times What are you watching for?,#WomensSports #HerSportsDaily #SportsNews #WNBA #WomensBasketball,,2026 WNBA Schedule 30/08/2026 - The Athletic The New York Times
6,Tonight / Game Coverage,Softball,Game Recap,"""women's softball college world series when:3d"" - Google News","3 things to watch as Texas, Texas Tech begin Women's College World Series Final - MLB.com",2026-06-03T04:38:06+00:00,https://news.google.com/rss/articles/CBMifkFVX3lxTFAweGZ2d2kxUl9DSnJSLXZDMUsteWtwaVd5dkwzRVduQ0ZSVHlDM2FTSWV2SW10U0l2YVgxajZwLThTMVI2ZURZU2FMeEk3Rlp0bnA0Um1URlFUdG9rbUtxU0xiSGZuT3BhU25xY0pxZE4xaDNBRllYNzRXZ19qUQ?oc=5,Story post,"What happened, who stood out, and why it matters for Softball fans.",This is timely Softball coverage with a result fans may want explained quickly.,"3 things to watch as Texas, Texas Tech begin Women's College World Series Final - MLB.com Here is the quick breakdown and why it matters.",#WomensSports #HerSportsDaily #SportsNews #Softball #WCWS,,"3 things to watch as Texas, Texas Tech begin Women's College World Series Final MLB.com"
6,Tonight / Game Coverage,Softball,Game Recap,"""women's softball college world series when:3d"" - Google News","Red Raiders, Longhorns set for WCWS Finals - Texas Tech Red Raiders",2026-06-03T00:42:48+00:00,https://news.google.com/rss/articles/CBMijwFBVV95cUxNOEE0SGhJQUtUZFJtMUF0dHhCRGlwQ2d6TUh0OXRMemlDRmtwOHhuQ1huX3V4THNBVDQ3d2taanVsei1uWnFuVWZxbmQxMjVpSkVFSE9Za3NDVWszNlRFX3FaaGtQTjVKYlJqdVduNlFIU1BzWXhBRkpESjBhY1dabGxUZzlkREM0cG5SWFVycw?oc=5,Story post,"What happened, who stood out, and why it matters for Softball fans.",This is timely Softball coverage with a result fans may want explained quickly.,"Red Raiders, Longhorns set for WCWS Finals - Texas Tech Red Raiders Here is the quick breakdown and why it matters.",#WomensSports #HerSportsDaily #SportsNews #Softball #WCWS,,"Red Raiders, Longhorns set for WCWS Finals Texas Tech Red Raiders"
6,Culture & Impact,WNBA,Player Profile,"""women's sports WNBA OR NWSL OR PWHL when:3d"" - Google News",USWNT prepares for Brazil friendlies and Mallory Swanson returns - The IX Sports,2026-06-03T00:37:58+00:00,https://news.google.com/rss/articles/CBMizgFBVV95cUxOc3dwSU00aEk2bUhvc3A3XzRfek0zX2V6OWlWT1hraVBxVzJia05EVnpKc0lwcXdwNlVGQy1Bd1NBa3JoM0k0UWw3MFpjTFNST2RMNFBFOGNuVGFGcVhGc0ltRUk2a1F5OVotLWFVU2g2cU5tYXk5OHIwQnctMDJQZ0lwbF9lN0M5Tk1Ib25yZEVkbkhKWFd1TXlBNU4wWVExekhpNE9xMnM0Nm9pS0VQeGVSSjVUUDJiQmQ0SDl3Q1ZQcHhKZG1sLU9WTUxCdw?oc=5,Reel or story feature,The athlete story behind the headline.,This is a useful daily update that can help keep the audience informed and consistent with the brand.,USWNT prepares for Brazil friendlies and Mallory Swanson returns - The IX Sports What should we cover next?,#WomensSports #HerSportsDaily #SportsNews #WNBA #WomensBasketball,,USWNT prepares for Brazil friendlies and Mallory Swanson returns The IX Sports
6,Tonight / Game Coverage,Softball,Game Recap,"""women's softball college world series when:3d"" - Google News","Texas softball vs Texas Tech picks, predictions for 2026 WCWS finals - azcentral.com and The Arizona Republic",2026-06-02T22:28:00+00:00,https://news.google.com/rss/articles/CBMi1AFBVV95cUxPTGpmcU1VQnVzNTJkYldtZjA1SXhfUGt4a3NiTnNlLVBOX2J0cVA2MDQzeS10TVJ1SHF0eGRoNWYyV3RBQzFYS05EQ1VNd0FZMkVaaW11elVLSU96Vk5zQTBKVWtjM2JfUDdJWW1zZjFPSmhaX2N5dUdCVHZLSWp4blJKWFBHMTZTcGltaVpjbTk2Qzc2ZUNneXdDTUkzTVljVmtpNGc2YUwycElnY1Y3TFJsYlN1bW5XM1lleTBna2l2cEltN2Y4bmpxWWFsTzFjYXpCdg?oc=5,Story post,"What happened, who stood out, and why it matters for Softball fans.",This is timely Softball coverage with a result fans may want explained quickly.,"Texas softball vs Texas Tech picks, predictions for 2026 WCWS finals - azcentral.com and The Arizona Republic Here is the quick breakdown and why it matters.",#WomensSports #HerSportsDaily #SportsNews #Softball #WCWS,,"Texas softball vs Texas Tech picks, predictions for 2026 WCWS finals azcentral.com and The Arizona Republic"
6,Culture & Impact,WNBA,Player Profile,Women's Sports Foundation,2024 Next Gen Award Recipients,2024-10-03T14:30:22+00:00,https://www.womenssportsfoundation.org/sports/2024-next-gen-award-recipients/,Reel or story feature,The athlete story behind the headline.,This is a useful daily update that can help keep the audience informed and consistent with the brand.,2024 Next Gen Award Recipients What should we cover next?,#WomensSports #HerSportsDaily #SportsNews #WNBA #WomensBasketball,"Sports, Annual Salute, Awards, WNBA",Watching a WNBA game today is power and promise in action: the power of its foundational legacy and the promise of the next generation. Talent and thrilling competition have always been in the league; now the world knows it. The momentum of the past several years – parents taking their daughters and sons to WNBA […] The post 2024 Next Gen Award Recipients appeared first on Women's Sports Foundation .
6,Tonight / Game Coverage,Women's Sports,Game Recap,Women's Sports Foundation,2024 Wilma Rudolph Courage Award Recipients,2024-09-20T15:30:11+00:00,https://www.womenssportsfoundation.org/sports/2024-wilma-rudolph-courage-award-recipients/,Story post,"What happened, who stood out, and why it matters for Women's Sports fans.",This is timely Women's Sports coverage with a result fans may want explained quickly.,2024 Wilma Rudolph Courage Award Recipients Here is the quick breakdown and why it matters.,#WomensSports #HerSportsDaily #SportsNews,"Sports, Annual Salute, Awards, Wilma Rudolph Courage Award","It has been 25 years since the U.S. Women’s National Soccer Team’s legendary penalty shoot-out against China during the 1999 FIFA Women’s World Cup final, which secured the team — who became known as “The 99ers™” — a victory in front of 90,000 fans at the Rose Bowl in Pasadena, Calif. It is a triumph […] The post 2024 Wilma Rudolph Courage Award Recipients appeared first on Women's Sports Foundation ."
6,Growth of the Game,Women's Sports,Business / Growth,Women's Sports Foundation,2024 Billie Jean King Leadership Award Recipients,2024-09-20T15:28:07+00:00,https://www.womenssportsfoundation.org/sports/2024-billie-jean-king-leadership-award-recipients/,Data carousel,The business of women's sports is not emerging anymore. It is becoming big business.,This is a growth-of-the-game story that helps show why women's sports are becoming a major media and business opportunity.,2024 Billie Jean King Leadership Award Recipients The growth of women's sports keeps getting harder to ignore.,#WomensSports #HerSportsDaily #SportsNews,"Sports, Annual Salute, Awards, Billie Jean King Leadership Award, Leadership","Kimbra and Mark Walter For decades, Kimbra and Mark Walter have been working to make the world a better place, one investment at a time. They share a commitment to social justice and equity that has led them to help drive the explosive growth of women’s sports. Their understanding that women’s sports is a wise […] The post 2024 Billie Jean King Leadership Award Recipients appeared first on Women's Sports Foundation ."
6,Daily News,Tennis,Awards / Rankings,Women's Sports Foundation,2023 Billie Jean King Leadership Award Recipient,2023-09-13T22:05:48+00:00,https://www.womenssportsfoundation.org/sports/2023-billie-jean-king-leadership-award-recipient/,Single graphic,Quick hit: 2023 Billie Jean King Leadership Award Recipient,This is a useful daily update that can help keep the audience informed and consistent with the brand.,2023 Billie Jean King Leadership Award Recipient What should we cover next?,#WomensSports #HerSportsDaily #SportsNews #WTA #Tennis,"Sports, Annual Salute, Awards, Billie Jean King Leadership Award, Tennis","Stacey Allaster Photo Credit: USTA Chief Executive of Professional Tennis at the USTA and Tournament Director of the US Open “I have always found a way. No matter what the challenge is.” For over 30 years, Stacey Allaster has demonstrated that no obstacle is too great for her to overcome. Despite never having played professional […] The post 2023 Billie Jean King Leadership Award Recipient appeared first on Women's Sports Foundation ."
5,Daily News,NWSL / Women's Soccer,General News,"""NWSL women's soccer when:3d"" - Google News",USL Super League to flip calendar to align with NWSL - ESPN,2026-06-05T16:38:00+00:00,https://news.google.com/rss/articles/CBMikAFBVV95cUxQNDE0MmtRUHlLMEZpenlxcjJTTXVfZXVIbHhBNnpmdHk5SERrNHFvMWtidVRzUU5lY3RmcDJDZ29ZUFdMMHNOeGhJM2F2a1BhOF82eFhFdFlSUWlRNkxQTkVVY2pnck5vN29UVHhZaHJVQjk0bUJqampfUjloc0tKbkt3RXZtazFyWFVQNkJKazE?oc=5,Story post,Quick hit: USL Super League to flip calendar to align with NWSL - ESPN,This is a useful daily update that can help keep the audience informed and consistent with the brand.,USL Super League to flip calendar to align with NWSL - ESPN What should we cover next?,#WomensSports #HerSportsDaily #SportsNews #NWSL #USWNT #WomensSoccer,,USL Super League to flip calendar to align with NWSL ESPN
5,Daily News,NWSL / Women's Soccer,General News,"""NWSL women's soccer when:3d"" - Google News",San Diego Wave FC Midfielder Kimmi Ascanio Named to NWSL Best XI of May - San Diego Wave Fútbol Club,2026-06-05T16:31:12+00:00,https://news.google.com/rss/articles/CBMioAFBVV95cUxPOWUzZGtSMm5lNVQxeklHSDB6RmIwS1VVWWpLcW1EMGZ4SGN6V2RfWU94Y2UzV2NDVU9pZkMwck5xRHAwYm5JZk42Zk8tMS1vRGxKbUJ4WjRNQk9HRUxCeklrS0JVYk5qdjN1T3Vpbm4zYTVPOWM2TVNqalhWQXFWNGZIUFc3M0hOeVhGOGZ0RTJaNDJFNGxtc3VTVkRzOEYx?oc=5,Story post,Quick hit: San Diego Wave FC Midfielder Kimmi Ascanio Named to NWSL Best XI of May - San Diego Wave Fútbol Club,This is a useful daily update that can help keep the audience informed and consistent with the brand.,San Diego Wave FC Midfielder Kimmi Ascanio Named to NWSL Best XI of May - San Diego Wave Fútbol Club What should we cover next?,#WomensSports #HerSportsDaily #SportsNews #NWSL #USWNT #WomensSoccer,,San Diego Wave FC Midfielder Kimmi Ascanio Named to NWSL Best XI of May San Diego Wave Fútbol Club
5,Daily News,WNBA,General News,"""WNBA when:3d"" - Google News",IU women’s basketball adds former WNBA head coach Fred Williams as assistant - The Daily Hoosier,2026-06-05T16:21:51+00:00,https://news.google.com/rss/articles/CBMirAFBVV95cUxPdFNGNElGal9wV3NlQzdBSTY5YjFUbjFsOGNPcmJ0Y3ZkVkNvXzg4bTVWeDdnbGtxcXlUVS15UkZBZ3lWb0kzX2txTWVPSHZ5WjhacS0xRTdRd1ZETzdhcDJHWXdQSWhlVTc0dFlvNFFrYWRadHJuY1FyRllxSzN5NVVqSUpualRCMkFrbnhsYmRXRGo5RVZUWGxvT0g1ZGNxUmxpZ2ZvMnN6SmZE?oc=5,Story post,Quick hit: IU women’s basketball adds former WNBA head coach Fred Williams as assistant - The Daily Hoosier,This is a useful daily update that can help keep the audience informed and consistent with the brand.,IU women’s basketball adds former WNBA head coach Fred Williams as assistant - The Daily Hoosier What should we cover next?,#WomensSports #HerSportsDaily #SportsNews #WNBA #WomensBasketball,,IU women’s basketball adds former WNBA head coach Fred Williams as assistant The Daily Hoosier
5,Daily News,NWSL / Women's Soccer,General News,"""NWSL women's soccer when:3d"" - Google News",Washington Spirit Forward Claudia Martínez Called Up to Paraguay Women’s National Team - Washington Spirit,2026-06-05T16:12:13+00:00,https://news.google.com/rss/articles/CBMizgFBVV95cUxOcm9CSTNYc1dycGRvZ0tXYWVsM2tscEdUaDR2bWRIdGZZRmlBWXRreXUxdXN1LVZrRkZ6WUdkSXI0SXlSaV85Tkt2TXI3T0dqdE5PaW9iOU9yTVhzb2ZOcmtTdU85eUVQdHJtTFkyRF9KM0dXU2FOVWpCSW04MVROWHZNekJnaVU3RDRIdkdyWUl5WkdaR3JYZ2NEajhGb0k4REJFWGRTczhhdlhPemtVVDlERFN1NWJTOEFmcUt5UHBMLWQyWDgzVk04eVZDQQ?oc=5,Story post,Quick hit: Washington Spirit Forward Claudia Martínez Called Up to Paraguay Women’s National Team - Washington Spirit,This is a useful daily update that can help keep the audience informed and consistent with the brand.,Washington Spirit Forward Claudia Martínez Called Up to Paraguay Women’s National Team - Washington Spirit What should we cover next?,#WomensSports #HerSportsDaily #SportsNews #NWSL #USWNT #WomensSoccer,,Washington Spirit Forward Claudia Martínez Called Up to Paraguay Women’s National Team Washington Spirit
5,College Spotlight,Softball,General News,"""women's softball college world series when:3d"" - Google News",Texas repeats! Longhorns sweep rival Texas Tech to win second straight national title - The New York Times,2026-06-05T16:09:26+00:00,https://news.google.com/rss/articles/CBMiqwFBVV95cUxOOGNFNFhhV2F5U1dWWFEyajR2NUFYTmwyRmhWcmpPUmE1SlpzRlNlbENUZ18zWnJobDVkMGFkQzdLZXVUWi1xUExDT3huUmhNaTJiX1pwYVBYS0VYdjJjLWw5TU8yd0k2b1JUejB1QnFpQXNJaHFvTG9kUFRGeGFqT1dneWs4ZnVJV0hCTEFJYzF1MktoVFVJcHJqbUlvZ3FoNmZYeVNCUUIwV0k?oc=5,Story post,Quick hit: Texas repeats! Longhorns sweep rival Texas Tech to win second straight national title - The New York Times,This is a useful daily update that can help keep the audience informed and consistent with the brand.,Texas repeats! Longhorns sweep rival Texas Tech to win second straight national title - The New York Times What should we cover next?,#WomensSports #HerSportsDaily #SportsNews #Softball #WCWS,,Texas repeats! Longhorns sweep rival Texas Tech to win second straight national title The New York Times
5,Daily News,NWSL / Women's Soccer,General News,"""NWSL women's soccer when:3d"" - Google News","Barbra Banda named to May NWSL Best XI of the Month, presented by Amazon Prime - Orlando City",2026-06-05T16:05:21+00:00,https://news.google.com/rss/articles/CBMiugFBVV95cUxQbHFUWnRmcEk0RnZSS0I4N1FROTV4SGs0WmNocFJETHBTS3l5X051SVRURjM3QlgyZjBsTkpfQVd4d0R6anVNbTNsNXFSVERoc2V5MTZVMVpjcWVLUG9ocVMtRE1xd2duODRkS1dCZEl6b0FDWWFlTV9EeTExd1VPQkNjNTRrcnNxcWZubTZPbHNXdzhvZU84MFF6Q3ByUEtCaDNxa0ZabjFfWVJJOXZxaF9kb0ZTbkNUZ2c?oc=5,Story post,"Quick hit: Barbra Banda named to May NWSL Best XI of the Month, presented by Amazon Prime - Orlando City",This is a useful daily update that can help keep the audience informed and consistent with the brand.,"Barbra Banda named to May NWSL Best XI of the Month, presented by Amazon Prime - Orlando City What should we cover next?",#WomensSports #HerSportsDaily #SportsNews #NWSL #USWNT #WomensSoccer,,"Barbra Banda named to May NWSL Best XI of the Month, presented by Amazon Prime Orlando City"
5,Daily News,NWSL / Women's Soccer,General News,"""NWSL women's soccer when:3d"" - Google News",Guadalajara World Cup 2026 Host City Guide - The New York Times,2026-06-05T16:04:35+00:00,https://news.google.com/rss/articles/CBMiZkFVX3lxTE1Wd0xpSTFONlRnVGhzQzZ2QTkyWlBVNnV3QmxkOVlGcThNOUhmUFNSNnBsWmc2VWxzb3VtSndpaS1xMmpQTTVzWnoyM2JiT2I2cGV0Tzh6WGUtc3dUWEJQUjZDS1BaZw?oc=5,Story post,Quick hit: Guadalajara World Cup 2026 Host City Guide - The New York Times,This is a useful daily update that can help keep the audience informed and consistent with the brand.,Guadalajara World Cup 2026 Host City Guide - The New York Times What should we cover next?,#WomensSports #HerSportsDaily #SportsNews #NWSL #USWNT #WomensSoccer,,Guadalajara World Cup 2026 Host City Guide The New York Times
5,Daily News,WNBA,General News,"""WNBA when:3d"" - Google News",CULMINA SALTILLO SOCCER GANANDO / SIGUE DE LÍDER EN LIGA TDP Wnba (77soQoaSAW) - Mshale,2026-06-05T15:49:06+00:00,https://news.google.com/rss/articles/CBMiW0FVX3lxTE1hUHJWVmdRSnZtbnhlLWdiYm80eHNGWEtPeGtyTVBQc2hRbTJ2SW53WlNzc3RBaVBsSWFXZFJZbG5ZQkx5bzFNLTBIZnRkc3E4d3ppRDkxYm1lMXc?oc=5,Story post,Quick hit: CULMINA SALTILLO SOCCER GANANDO / SIGUE DE LÍDER EN LIGA TDP Wnba (77soQoaSAW) - Mshale,This is a useful daily update that can help keep the audience informed and consistent with the brand.,CULMINA SALTILLO SOCCER GANANDO / SIGUE DE LÍDER EN LIGA TDP Wnba (77soQoaSAW) - Mshale What should we cover next?,#WomensSports #HerSportsDaily #SportsNews #WNBA #WomensBasketball,,CULMINA SALTILLO SOCCER GANANDO / SIGUE DE LÍDER EN LIGA TDP Wnba (77soQoaSAW) Mshale
5,Daily News,NWSL / Women's Soccer,General News,"""NWSL women's soccer when:3d"" - Google News",Houston Dash extend Maggie Graham through 2029 season - All For XI,2026-06-05T15:46:55+00:00,https://news.google.com/rss/articles/CBMikwFBVV95cUxPcG94dVlnaFpRYVIyRGdhWGV2dElTNENpYy1ReGZPc0dXaERLSWRDOXNEVkIyY0FtajZKUm1FUmtXN0ZLemF3ODZDQ3RMamIwNDVOa0Z1T2JXT2JKVmZfcUFHM1RCY3NEY3dybWNnTE9JUUtaaE8zUXlZazRvZkRGM0FiQzluLUNwN0NtYW53RlQ4RFE?oc=5,Story post,Quick hit: Houston Dash extend Maggie Graham through 2029 season - All For XI,This is a useful daily update that can help keep the audience informed and consistent with the brand.,Houston Dash extend Maggie Graham through 2029 season - All For XI What should we cover next?,#WomensSports #HerSportsDaily #SportsNews #NWSL #USWNT #WomensSoccer,,Houston Dash extend Maggie Graham through 2029 season All For XI
5,Daily News,WNBA,General News,"""WNBA when:3d"" - Google News",Golden State Valkyries guard Veronica Burton: ‘These are the moments I prayed for’ - Andscape,2026-06-05T15:31:26+00:00,https://news.google.com/rss/articles/CBMimgFBVV95cUxQNGp3ZXNlUmltdnhvbnRDU1JJV2VDQUJ4RHVXVmJrMEN4RkdGRl9hRFU4YzNGVlIzUU9RZE1Udmd0Q1hoSnRCd0ljeUNtbTlIQ0E3LTZfS2U1c3hEV3RUYXBjX191Q181aENYRElwYjk4V2NZelJDdEJINWotNFhoeVoyRmF0cV9Hc1VBT3lkQVJpZnRubG82bmln?oc=5,Story post,Quick hit: Golden State Valkyries guard Veronica Burton: ‘These are the moments I prayed for’ - Andscape,This is a useful daily update that can help keep the audience informed and consistent with the brand.,Golden State Valkyries guard Veronica Burton: ‘These are the moments I prayed for’ - Andscape What should we cover next?,#WomensSports #HerSportsDaily #SportsNews #WNBA #WomensBasketball,,Golden State Valkyries guard Veronica Burton: ‘These are the moments I prayed for’ Andscape
5,College Spotlight,Softball,General News,Just Women's Sports,Texas Builds College Softball Dynasty Cred with 2026 WCWS Sweep Over Texas Tech,2026-06-05T15:29:47+00:00,https://justwomenssports.com/reads/game-2-wcws-teagan-kavan-texas-wcws-winners-score-2026/,Story post,Quick hit: Texas Builds College Softball Dynasty Cred with 2026 WCWS Sweep Over Texas Tech,This is a useful daily update that can help keep the audience informed and consistent with the brand.,Texas Builds College Softball Dynasty Cred with 2026 WCWS Sweep Over Texas Tech What should we cover next?,#WomensSports #HerSportsDaily #SportsNews #Softball #WCWS,"NCAA, News, Soccer, 2026 NCAA Softball Tournament, 2026 WCWS, NiJaree Canady, Teagan Kavan, Texas softball, Texas Tech softball","Teagan Kavan shut the door in Game 2 of the 2026 WCWS, crowning Texas as back-to-back World Series winners with a 4-1 victory over Texas Tech. The post Texas Builds College Softball Dynasty Cred with 2026 WCWS Sweep Over Texas Tech appeared first on Just Women's Sports ."
5,Daily News,WNBA,General News,"""WNBA when:3d"" - Google News",Dallas Wings @ Chicago Sky (8/2/2022) - WNBA,2026-06-05T15:22:18+00:00,https://news.google.com/rss/articles/CBMid0FVX3lxTE5lTGluUlNPcndiSkpKTHBRX0NCN2h2SkRsckxxS19qbEpwSFQwTFhhaXhTRExZTzZRREtkUTJPTlJZd3FlZ1Y1R1R4ZkRycUpNMmpoU2xGeUMyZUwxeFp1Q05aLVFVMmR3bE55QTJQS0hhb2dTNEFr?oc=5,Story post,Quick hit: Dallas Wings @ Chicago Sky (8/2/2022) - WNBA,This is a useful daily update that can help keep the audience informed and consistent with the brand.,Dallas Wings @ Chicago Sky (8/2/2022) - WNBA What should we cover next?,#WomensSports #HerSportsDaily #SportsNews #WNBA #WomensBasketball,,Dallas Wings @ Chicago Sky (8/2/2022) WNBA
5,Daily News,PWHL / Women's Hockey,General News,"""PWHL women's hockey when:3d"" - Google News",Goldeneyes focus on culture and long-term plans with Phase 1 protections - The IX Sports,2026-06-05T15:18:21+00:00,https://news.google.com/rss/articles/CBMi0gFBVV95cUxNWkxlbkx0M1pyU3hpTjhaOWYzT0FQeTJBZ2ltc0lMWkRIMWxVNG1pYXROMGh1TVNkenFuc05kbjZ0WkRSRnFoNllycjBISEhZVnBYUllWbnZaT1ZIU18zaFFQdklNOHE0WmNObjdXWEpIWG9FRG5RV09XTVM3VTVORWRCbnc5TFBFOWxTQmhfMlpaazA3Rjg5ejRBSDZoaEw0Z2hPR1Mtb0x6YklqR3RPN1JPWXRmRjYxanVKb2tRbVhhUG9KTjFoOG9LT1EybTJTV3c?oc=5,Story post,Quick hit: Goldeneyes focus on culture and long-term plans with Phase 1 protections - The IX Sports,This is a useful daily update that can help keep the audience informed and consistent with the brand.,Goldeneyes focus on culture and long-term plans with Phase 1 protections - The IX Sports What should we cover next?,#WomensSports #HerSportsDaily #SportsNews #PWHL #WomensHockey,,Goldeneyes focus on culture and long-term plans with Phase 1 protections The IX Sports
5,Daily News,WNBA,General News,"""WNBA when:3d"" - Google News",WNBA veteran takes over HBCU program - HBCU Gameday,2026-06-05T14:48:45+00:00,https://news.google.com/rss/articles/CBMifEFVX3lxTE9FYmNGWGt3dFhCQjVXZ3FaR0ZwSmFmVFVPaEFfeHhVWldqNm44T1FRQWY4WUJoX0RWdkZ4QW5lY0VleFFUdmIyX1U4SENwQXh0NHFESFVtWWUtb2JPb2NzZnAzMEpPdWQybzJDNHJZZV9OUWVLeHo4cVZ1SFo?oc=5,Story post,Quick hit: WNBA veteran takes over HBCU program - HBCU Gameday,This is a useful daily update that can help keep the audience informed and consistent with the brand.,WNBA veteran takes over HBCU program - HBCU Gameday What should we cover next?,#WomensSports #HerSportsDaily #SportsNews #WNBA #WomensBasketball,,WNBA veteran takes over HBCU program HBCU Gameday
5,Daily News,WNBA,Injury / Availability,"""WNBA when:3d"" - Google News",Sophie Cunningham stuns in tight leather outfit before WNBA game as fans call Indiana Fever star 'pure class' - the-sun.com,2026-06-05T14:40:06+00:00,https://news.google.com/rss/articles/CBMimgFBVV95cUxONGJHWmpjMHZZR2p0NEp5V25pQnItbnhmTGJFZVFGQm42ZTV1dG00T01LeWJSaGpPNklXaGNMcEY1VTVoQmtkOVNBeGRJU0tpRnBfMHoySllvdUNSc29yRWJESWJJZkp6eFJJQk0tU3J2OVZVV3doUXRSRGJFRTZ0S2h2UGYtM082d2c5NWhDNjBXQjRqaG5RMWdn?oc=5,Story post,Quick hit: Sophie Cunningham stuns in tight leather outfit before WNBA game as fans call Indiana Fever star 'pure class' - the-sun.com,This is a useful daily update that can help keep the audience informed and consistent with the brand.,Sophie Cunningham stuns in tight leather outfit before WNBA game as fans call Indiana Fever star 'pure class' - the-sun.com What should we cover next?,#WomensSports #HerSportsDaily #SportsNews #WNBA #WomensBasketball,,Sophie Cunningham stuns in tight leather outfit before WNBA game as fans call Indiana Fever star 'pure class' the-sun.com
