rank,headline,sport,story_type,source,link,context_confidence,context_source_status,verified_context_notes,story_summary,key_fact_1,key_fact_2,key_fact_3,key_fact_4,winner,loser,final_score,matchup,game_time,tv_network,key_player_1,key_player_1_statline,key_player_2,key_player_2_statline,watch_angle,round_or_event,top_performer_1,top_performer_1_statline,top_performer_2,top_performer_2_statline,milestone_text,historical_context,key_number,number_context,business_impact,main_takeaway,next_game_or_implication,manual_review_flag,supplemental_search_queries,supplemental_source_count,supplemental_sources
1,WNBA gameday discussion: Can the Toronto Tempo and Portland Fire earn their first-ever Commissioner's Cup wins?,WNBA,Game Recap / Result,Swish Appeal,https://news.google.com/rss/articles/CBMi7AFBVV95cUxOY283eGRFakt3a2tLNWFhZ09ITzFFVmdnejhFOURWUjRQUTZkY29KeUVwcjRBNlB4Q1lDWGdMaDUzYXdEYmZWR21RM3BhVXdiRnVWR3Yyb2I1elZDNU5rYjFBT1ZnSDk5ak1Qb21PQ2o4b2VhVHNxTGVJbWgzV3pXNVYxeVd5WDRKVUo5QWFMbzdrc2laUWRvc0l6OTJjRmVtRmc1dE9YbVk5QkNqRGtMY1k0WnVRZXBJY0Z3dlFZOEE2cTM1d2NUWjdTR25KOFhudFpvWWs5QjdPUXF5UERGM1FqVlZlUlBoMnR6eQ?oc=5,Medium,supplemental_search,"Skipped Google News aggregator URL. Supplemental searches used: ""WNBA gameday discussion: Can the Toronto Tempo and Portland Fire earn their first-ever Commissioner's Cup wins?"" score | WNBA gameday discussion: Can the Toronto Tempo and Portland Fire earn their first-ever Commissioner's Cup wins? final score | WNBA gameday discussion: Can the Toronto Tempo and Portland Fire earn their first-ever Commissioner's Cup wins? box score | WNBA gameday discussion: Can the Toronto Tempo and Portland Fire earn their first-ever Commissioner's Cup wins? WNBA box score | site:wnba.com WNBA gameday discussion: Can the Toronto Tempo and Portland Fire earn their first-ever Commissioner's Cup wins? box score Supplemental source context: Swish Appeal (Strong): WNBA gameday discussion: Can the Toronto Tempo and Portland Fire earn their first-ever Commissioner's Cup wins? || Swish Appeal (Strong): WNBA gameday discussion: Does defense win Commissioner's Cup championships? These teams hope so || Swish Appeal (Strong): WNBA gameday discussion: Does defense win Commissioner's Cup championships? Verify exact stats, scores, records, player details, and jersey numbers before final design.",WNBA gameday discussion: Can the Toronto Tempo and Portland Fire earn their first-ever Commissioner's Cup wins?,WNBA gameday discussion: Can the Toronto Tempo and Portland Fire earn their first-ever Commissioner's Cup wins?,WNBA gameday discussion: Does defense win Commissioner's Cup championships? These teams hope so,WNBA gameday discussion: Does defense win Commissioner's Cup championships?,"WNBA gameday discussion: Do the Toronto Tempo, Indiana Fever or Los Angeles Sparks need their first win the most?",,,,,,,,,,,,,,,,,,,,,,WNBA gameday discussion: Does defense win Commissioner's Cup championships? These teams hope so,,Yes,"""WNBA gameday discussion: Can the Toronto Tempo and Portland Fire earn their first-ever Commissioner's Cup wins?"" score | WNBA gameday discussion: Can the Toronto Tempo and Portland Fire earn their first-ever Commissioner's Cup wins? final score | WNBA gameday discussion: Can the Toronto Tempo and Portland Fire earn their first-ever Commissioner's Cup wins? box score | WNBA gameday discussion: Can the Toronto Tempo and Portland Fire earn their first-ever Commissioner's Cup wins? WNBA box score | site:wnba.com WNBA gameday discussion: Can the Toronto Tempo and Portland Fire earn their first-ever Commissioner's Cup wins? box score",5,"Swish Appeal (Strong): WNBA gameday discussion: Can the Toronto Tempo and Portland Fire earn their first-ever Commissioner's Cup wins? || Swish Appeal (Strong): WNBA gameday discussion: Does defense win Commissioner's Cup championships? These teams hope so || Swish Appeal (Strong): WNBA gameday discussion: Does defense win Commissioner's Cup championships? || Swish Appeal (Strong): WNBA gameday discussion: Do the Toronto Tempo, Indiana Fever or Los Angeles Sparks need their first win the most? || Swish Appeal (Strong): WNBA gameday discussion: On three-game winning streaks, are the Minnesota Lynx or Portland Fire the biggest early-season surprise?"
2,"Indiana Fever vs. New York Liberty - Final Score - June 06, 2026",WNBA,Game Recap / Result,FOX Sports,https://news.google.com/rss/articles/CBMimwFBVV95cUxPVDVrR0tDOXotbTFmR2pBeDM3UjdyR3oyc1lHQ3FJMXN0N0tZSVpzbnZycHRaSXdHa1ZqNkVxNFJDU1NmOGZ3OEFmV2lJX1lKT2lQYTR4dVd1eXJ3MzktdkhERVRaN2J1OWtrSjdqRmh6cmx6RUFNLWhlLWI3dV9HcUtSX1BRUkFCM1U4cHlSbW9JUHNmSktUNlRkbw?oc=5,Medium,supplemental_search,"Skipped Google News aggregator URL. Supplemental searches used: ""Indiana Fever vs. New York Liberty - Final Score - June 06, 2026"" score | Indiana Fever vs. New York Liberty - Final Score - June 06, 2026 final score | Indiana Fever vs. New York Liberty - Final Score - June 06, 2026 box score | Indiana Fever vs. New York Liberty - Final Score - June 06, 2026 WNBA box score | site:wnba.com Indiana Fever vs. New York Liberty - Final Score - June 06, 2026 box score Supplemental source context: CBS Sports (Strong): Indiana Fever vs. New York Liberty Live Score and Stats - June 6, 2026 Gametracker || MSN (Other): How many points did Caitlin Clark score tonight in Indiana Fever vs New York Liberty? || IndyStar (Other): Indiana Fever, Caitlin Clark vs New York Liberty score updates: Fever fade under pressure from Liberty Verify exact stats, scores, records, player details, and jersey numbers before final design.","Indiana Fever vs. New York Liberty Live Score and Stats - June 6, 2026 Gametracker","Indiana Fever vs. New York Liberty Live Score and Stats - June 6, 2026 Gametracker",How many points did Caitlin Clark score tonight in Indiana Fever vs New York Liberty?,"Indiana Fever, Caitlin Clark vs New York Liberty score updates: Fever fade under pressure from Liberty","Indiana Fever, Caitlin Clark vs New York Liberty score updates: Fever fade under pressure from Liberty IndyStar",,,,,,,,,,,,,,,,,,,,,,How many points did Caitlin Clark score tonight in Indiana Fever vs New York Liberty?,,Yes,"""Indiana Fever vs. New York Liberty - Final Score - June 06, 2026"" score | Indiana Fever vs. New York Liberty - Final Score - June 06, 2026 final score | Indiana Fever vs. New York Liberty - Final Score - June 06, 2026 box score | Indiana Fever vs. New York Liberty - Final Score - June 06, 2026 WNBA box score | site:wnba.com Indiana Fever vs. New York Liberty - Final Score - June 06, 2026 box score",5,"CBS Sports (Strong): Indiana Fever vs. New York Liberty Live Score and Stats - June 6, 2026 Gametracker || MSN (Other): How many points did Caitlin Clark score tonight in Indiana Fever vs New York Liberty? || IndyStar (Other): Indiana Fever, Caitlin Clark vs New York Liberty score updates: Fever fade under pressure from Liberty || IndyStar (Other): Indiana Fever, Caitlin Clark vs New York Liberty score updates: Fever fade under pressure from Liberty IndyStar || The New York Times (Other): Liberty's Breanna Stewart scores 30, helps New York rally past Indiana Fever - The Athletic"
3,‘This Fall From Grace Needs to Be Studied' — WNBA World Rips Caitlin Clark for Ignoring Teammate During Fever-Liberty,WNBA,Record / Milestone,Pro Football Network,https://sports.yahoo.com/articles/fall-grace-needs-studied-wnba-104530864.html,High,direct_article_plus_supplemental_search,"Fetched direct article text. Supplemental searches used: ""‘This Fall From Grace Needs to Be Studied' — WNBA World Rips Caitlin Clark for Ignoring Teammate During Fever-Liberty"" record stats | ‘This Fall From Grace Needs to Be Studied' — WNBA World Rips Caitlin Clark for Ignoring Teammate During Fever-Liberty exact record | ‘This Fall From Grace Needs to Be Studied' — WNBA World Rips Caitlin Clark for Ignoring Teammate During Fever-Liberty milestone stats | ‘This Fall From Grace Needs to Be Studied' — WNBA World Rips Caitlin Clark for Ignoring Teammate During Fever-Liberty WNBA records stats | ‘This Fall From Grace Needs to Be Studied' — WNBA World Rips Caitlin Clark for Ignoring Teammate During Fever-Liberty Pro Football Network Supplemental source context: PFSN (Other): ‘Worst Display of Basketball Ever' -- WNBA World Bashes Caitlin Clark, Fever's ‘Chemistry Issues' After Loss to Liberty || PFSN (Other): ‘Worst Display of Basketball Ever' -- WNBA World Bashes Caitlin Clark, Fever's ‘Chemistry Issues' After Loss to Liberty. ‘Worst Display of Basketball Ever' -- WNBA World Bashes Caitlin Clark, Fever's ‘Chemistry Issues' After Loss to Liberty PFSN","Meanwhile, Caitlin Clark posted 10 points in a disheartening loss that also had the WNBA community slamming the Fever star's body language late in the game.","Meanwhile, Caitlin Clark posted 10 points in a disheartening loss that also had the WNBA community slamming the Fever star's body language late in the game.","In Sabrina Ionescu 's absence, Breanna Stewart anchored New York's comeback with 30 points and a franchise-record 18 made free throws.","Still an elite talent but everything seems so negative and tense around her situation in the WNBA,"" HoopHerald shared. ""No one who actually watched her college career closely instead of simply getting caught up in all the hype is surprised,"" another user claimed. ""Folks called us every name in the book for calling out the sort of entitled behavior, this is nasty behavior from a fellow teammate,"" one account wrote.",The New York Liberty tightened their defense late in the game and erased a double-digit second-half deficit to hand the Indiana Fever an 83-75 loss on Saturday night.,,,83-75,,,,,,,,,,,,,,10 points,"In Sabrina Ionescu 's absence, Breanna Stewart anchored New York's comeback with 30 points and a franchise-record 18 made free throws.",10 points,"Meanwhile, Caitlin Clark posted 10 points in a disheartening loss that also had the WNBA community slamming the Fever star's body language late in the game.",,"In Sabrina Ionescu 's absence, Breanna Stewart anchored New York's comeback with 30 points and a franchise-record 18 made free throws.",,No,"""‘This Fall From Grace Needs to Be Studied' — WNBA World Rips Caitlin Clark for Ignoring Teammate During Fever-Liberty"" record stats | ‘This Fall From Grace Needs to Be Studied' — WNBA World Rips Caitlin Clark for Ignoring Teammate During Fever-Liberty exact record | ‘This Fall From Grace Needs to Be Studied' — WNBA World Rips Caitlin Clark for Ignoring Teammate During Fever-Liberty milestone stats | ‘This Fall From Grace Needs to Be Studied' — WNBA World Rips Caitlin Clark for Ignoring Teammate During Fever-Liberty WNBA records stats | ‘This Fall From Grace Needs to Be Studied' — WNBA World Rips Caitlin Clark for Ignoring Teammate During Fever-Liberty Pro Football Network",2,"PFSN (Other): ‘Worst Display of Basketball Ever' -- WNBA World Bashes Caitlin Clark, Fever's ‘Chemistry Issues' After Loss to Liberty || PFSN (Other): ‘Worst Display of Basketball Ever' -- WNBA World Bashes Caitlin Clark, Fever's ‘Chemistry Issues' After Loss to Liberty. ‘Worst Display of Basketball Ever' -- WNBA World Bashes Caitlin Clark, Fever's ‘Chemistry Issues' After Loss to Liberty PFSN"
4,Top seeds Siniakova and Townsend clinch French Open women's doubles title,Women's Sports,Game Recap / Result,Reuters,https://news.google.com/rss/articles/CBMiugFBVV95cUxQeDFIT1I1eXoxa1h4dHRqUEFzR3N3Ulk2ZUhvR2tmTGhJQzhQS2pZclN3dm5teEE0ZVNtb2gyNHptdTRnMWVxUzd2aXVLTmNTVFBfVUFsWGM4YjJ5MGloY2JLZjB6T0VHazlwcGcxQkJNeFhORUtxbnJlMUJPX0Yxbm1NV2k3QjRKQmthR0xleThGdjE1MzZ0NUNCN191TTJmRHZzb1VoX01ZSlhCN2IydHM3YkQ0dXpwMlE?oc=5,Medium,supplemental_search,"Skipped Google News aggregator URL. Supplemental searches used: ""Top seeds Siniakova and Townsend clinch French Open women's doubles title"" score | Top seeds Siniakova and Townsend clinch French Open women's doubles title final score | Top seeds Siniakova and Townsend clinch French Open women's doubles title box score | Top seeds Siniakova and Townsend clinch French Open women's doubles title Reuters Supplemental source context: Reuters (Strong): Top seeds Siniakova and Townsend clinch French Open women's doubles title || Reuters (Strong): Top seeds Siniakova and Townsend clinch French Open women's doubles title Reuters || NST Online (Other): Top seeds Siniakova and Townsend clinch French Open women's doubles title NST Online Verify exact stats, scores, records, player details, and jersey numbers before final design.",Top seeds Siniakova and Townsend clinch French Open women's doubles title,Top seeds Siniakova and Townsend clinch French Open women's doubles title,Top seeds Siniakova and Townsend clinch French Open women's doubles title Reuters,Top seeds Siniakova and Townsend clinch French Open women's doubles title NST Online,French Open 2026: Top seeds Siniakova and Townsend clinch women's doubles title,,,,,,,,,,,,,,,,,,,,,,Top seeds Siniakova and Townsend clinch French Open women's doubles title Reuters,,Yes,"""Top seeds Siniakova and Townsend clinch French Open women's doubles title"" score | Top seeds Siniakova and Townsend clinch French Open women's doubles title final score | Top seeds Siniakova and Townsend clinch French Open women's doubles title box score | Top seeds Siniakova and Townsend clinch French Open women's doubles title Reuters",5,Reuters (Strong): Top seeds Siniakova and Townsend clinch French Open women's doubles title || Reuters (Strong): Top seeds Siniakova and Townsend clinch French Open women's doubles title Reuters || NST Online (Other): Top seeds Siniakova and Townsend clinch French Open women's doubles title NST Online || Sportstar (Other): French Open 2026: Top seeds Siniakova and Townsend clinch women's doubles title || Sportstar (Other): French Open 2026: Top seeds Siniakova and Townsend clinch women's doubles title Sportstar
5,Reese Atwood Caps Texas Career with Back-to-Back WCWS Championships,Softball,Record / Milestone,Just Women's Sports,https://justwomenssports.com/reads/texas-softball-reese-atwood-wcws-championship-ausl-2026/,High,direct_article_plus_supplemental_search,"Fetched direct article text. Supplemental searches used: ""Reese Atwood Caps Texas Career with Back-to-Back WCWS Championships"" record stats | Reese Atwood Caps Texas Career with Back-to-Back WCWS Championships exact record | Reese Atwood Caps Texas Career with Back-to-Back WCWS Championships milestone stats | Reese Atwood Caps Texas Career with Back-to-Back WCWS Championships Just Women's Sports Supplemental source context: Just Women's Sports (Strong): Reese Atwood Caps Texas Career with Back-to-Back WCWS Championships || Just Women's Sports (Strong): Reese Atwood Caps Texas Career with Back-to-Back WCWS Championships Just Women's Sports || Just Women's Sports (Strong): Texas Scores First-Ever NCAA Softball Championship as 2025 WCWS Breaks Records",Reese Atwood Caps Texas Career with Back-to-Back WCWS Championships Texas softball legend Reese Atwood crowns her historic career with a second straight WCWS national championship before heading to the AUSL.,Reese Atwood Caps Texas Career with Back-to-Back WCWS Championships Texas softball legend Reese Atwood crowns her historic career with a second straight WCWS national championship before heading to the AUSL.,"Texas softball are back-to-back national champions, after the Longhorns defeated Texas Tech 4-1 on Thursday to clinch a second consecutive Women's College World Series title in Oklahoma City.","She's been an inspiration to everybody including myself."" Now, with her college career capped, Atwood is headed to the pros.","Over her four seasons, Texas went 209-49-1 with Atwood behind the plate.",,,4-1,,,,,,,,,,,,,,2025,"Texas softball are back-to-back national champions, after the Longhorns defeated Texas Tech 4-1 on Thursday to clinch a second consecutive Women's College World Series title in Oklahoma City.",2025,Reese Atwood Caps Texas Career with Back-to-Back WCWS Championships Texas softball legend Reese Atwood crowns her historic career with a second straight WCWS national championship before heading to the AUSL.,,"Texas softball are back-to-back national champions, after the Longhorns defeated Texas Tech 4-1 on Thursday to clinch a second consecutive Women's College World Series title in Oklahoma City.",,No,"""Reese Atwood Caps Texas Career with Back-to-Back WCWS Championships"" record stats | Reese Atwood Caps Texas Career with Back-to-Back WCWS Championships exact record | Reese Atwood Caps Texas Career with Back-to-Back WCWS Championships milestone stats | Reese Atwood Caps Texas Career with Back-to-Back WCWS Championships Just Women's Sports",5,Just Women's Sports (Strong): Reese Atwood Caps Texas Career with Back-to-Back WCWS Championships || Just Women's Sports (Strong): Reese Atwood Caps Texas Career with Back-to-Back WCWS Championships Just Women's Sports || Just Women's Sports (Strong): Texas Scores First-Ever NCAA Softball Championship as 2025 WCWS Breaks Records || Just Women's Sports (Strong): Texas Scores First-Ever NCAA Softball Championship as 2025 WCWS Breaks Records Just Women's Sports || statesman.com (Other): Reese Atwood says goodbye to Texas softball after historic career
6,"If she wins U.S. Women's Open, Nelly Korda will match one of the greatest achievements in American golf history",Golf / LPGA,Game Recap / Result,Yahoo Sports,https://news.google.com/rss/articles/CBMie0FVX3lxTE5GV25ZSDBOVFVZd3Zib0RjaWY4Nk5NaG9vNlZ0Q0FIUEVNWGxPNm9jdlNjZUg5WnZPUjlUMFBnTFgtbWtrZ2lZQ0h5S2cyWmhqZTF4bFZuZ1BCTXREeGhTUDFqT3RJSjZnOHlMRVhWOG1TVElZaFgtbWNmMA?oc=5,Medium,supplemental_search,"Skipped Google News aggregator URL. Supplemental searches used: ""If she wins U.S. Women's Open, Nelly Korda will match one of the greatest achievements in American golf history"" score | If she wins U.S. Women's Open, Nelly Korda will match one of the greatest achievements in American golf history final score | If she wins U.S. Women's Open, Nelly Korda will match one of the greatest achievements in American golf history box score | If she wins U.S. Women's Open, Nelly Korda will match one of the greatest achievements in American golf history Yahoo Sports Supplemental source context: Yahoo Sports (Strong): If she wins U.S. Women's Open, Nelly Korda will match one of the greatest achievements in American golf history || Yahoo Sports (Strong): Women's Open, Nelly Korda will match one of the greatest achievements in American golf history. || Yahoo Sports (Strong): Women's Open, Nelly Korda will match one of the greatest achievements in American golf history Yahoo Sports Verify exact stats, scores, records, player details, and jersey numbers before final design.","If she wins U.S. Women's Open, Nelly Korda will match one of the greatest achievements in American golf history","If she wins U.S. Women's Open, Nelly Korda will match one of the greatest achievements in American golf history","Women's Open, Nelly Korda will match one of the greatest achievements in American golf history.","Women's Open, Nelly Korda will match one of the greatest achievements in American golf history Yahoo Sports",Nelly Korda won 7 times last year and hasn't lifted a trophy in 2025 despite similar stats. How is that possible?,,,,,,,,,,,,,,,,,,,,,,"Women's Open, Nelly Korda will match one of the greatest achievements in American golf history.",,Yes,"""If she wins U.S. Women's Open, Nelly Korda will match one of the greatest achievements in American golf history"" score | If she wins U.S. Women's Open, Nelly Korda will match one of the greatest achievements in American golf history final score | If she wins U.S. Women's Open, Nelly Korda will match one of the greatest achievements in American golf history box score | If she wins U.S. Women's Open, Nelly Korda will match one of the greatest achievements in American golf history Yahoo Sports",5,"Yahoo Sports (Strong): If she wins U.S. Women's Open, Nelly Korda will match one of the greatest achievements in American golf history || Yahoo Sports (Strong): Women's Open, Nelly Korda will match one of the greatest achievements in American golf history. || Yahoo Sports (Strong): Women's Open, Nelly Korda will match one of the greatest achievements in American golf history Yahoo Sports || Golf Digest (Other): Nelly Korda won 7 times last year and hasn't lifted a trophy in 2025 despite similar stats. How is that possible? || Golf Digest (Other): Nelly Korda won 7 times last year and hasn't lifted a trophy in 2025 despite similar stats."
7,Seattle Torrent Sign Alex Carpenter To A Three-Year Extension Through 2028-29 Protecting Her From PWHL Expansion,PWHL / Women's Hockey,League Expansion,The Hockey News,https://news.google.com/rss/articles/CBMi5AFBVV95cUxNb2NNdXVsSHIxMWJhLWktcWxyMkg4U0JQWEZuTEpPam52c3NKT3c2eUZuT0l1bjR4YlZZdFA5bGljM0l2WGlHTE80RGJ0cjczcHZ6LXlNYmtMY0VVRHFvMlJKcnphdTQzRU5qdnhkM3VRYkxFQ1paalhza2xFeHQ2VmNOTnFqdUpjczFwckFmdEdvR081QkplWnFGeTZBWFBVQ2hJcW5kZjRoN1pCWDI1RVFGVmEtejVuUlU4NTR2bUNaU2tUQ3A3NG81ZjlnZ25YMGJRbHlpSWFRUi1WZzE2alVudjU?oc=5,Medium,supplemental_search,"Skipped Google News aggregator URL. Supplemental searches used: ""Seattle Torrent Sign Alex Carpenter To A Three-Year Extension Through 2028-29 Protecting Her From PWHL Expansion"" | Seattle Torrent Sign Alex Carpenter To A Three-Year Extension Through 2028-29 Protecting Her From PWHL Expansion amount number details | Seattle Torrent Sign Alex Carpenter To A Three-Year Extension Through 2028-29 Protecting Her From PWHL Expansion purse revenue viewership attendance investment | Seattle Torrent Sign Alex Carpenter To A Three-Year Extension Through 2028-29 Protecting Her From PWHL Expansion The Hockey News Supplemental source context: Professional Women's Hockey League (PWHL) (Other): SEATTLE TORRENT RE-SIGNS AND PROTECTS ALEX CARPENTER AHEAD OF 2026-27 SEASON Professional Women's Hockey League (PWHL) || Professional Women's Hockey League (PWHL) (Other): SEATTLE TORRENT RE-SIGNS AND PROTECTS ALEX CARPENTER AHEAD OF 2026-27 SEASON || Yahoo Sports (Strong): At Least One Leadership Piece Staying In Seattle As Alex Carpenter Becomes First Protected Player Verify exact stats, scores, records, player details, and jersey numbers before final design.",SEATTLE TORRENT RE-SIGNS AND PROTECTS ALEX CARPENTER AHEAD OF 2026-27 SEASON Professional Women's Hockey League (PWHL),SEATTLE TORRENT RE-SIGNS AND PROTECTS ALEX CARPENTER AHEAD OF 2026-27 SEASON Professional Women's Hockey League (PWHL),SEATTLE TORRENT RE-SIGNS AND PROTECTS ALEX CARPENTER AHEAD OF 2026-27 SEASON,At Least One Leadership Piece Staying In Seattle As Alex Carpenter Becomes First Protected Player,At Least One Leadership Piece Staying In Seattle As Alex Carpenter Becomes First Protected Player Yahoo Sports,,,,,,,,,,,,,,,,,,,,,SEATTLE TORRENT RE-SIGNS AND PROTECTS ALEX CARPENTER AHEAD OF 2026-27 SEASON,SEATTLE TORRENT RE-SIGNS AND PROTECTS ALEX CARPENTER AHEAD OF 2026-27 SEASON,,Yes,"""Seattle Torrent Sign Alex Carpenter To A Three-Year Extension Through 2028-29 Protecting Her From PWHL Expansion"" | Seattle Torrent Sign Alex Carpenter To A Three-Year Extension Through 2028-29 Protecting Her From PWHL Expansion amount number details | Seattle Torrent Sign Alex Carpenter To A Three-Year Extension Through 2028-29 Protecting Her From PWHL Expansion purse revenue viewership attendance investment | Seattle Torrent Sign Alex Carpenter To A Three-Year Extension Through 2028-29 Protecting Her From PWHL Expansion The Hockey News",5,Professional Women's Hockey League (PWHL) (Other): SEATTLE TORRENT RE-SIGNS AND PROTECTS ALEX CARPENTER AHEAD OF 2026-27 SEASON Professional Women's Hockey League (PWHL) || Professional Women's Hockey League (PWHL) (Other): SEATTLE TORRENT RE-SIGNS AND PROTECTS ALEX CARPENTER AHEAD OF 2026-27 SEASON || Yahoo Sports (Strong): At Least One Leadership Piece Staying In Seattle As Alex Carpenter Becomes First Protected Player || Yahoo Sports (Strong): At Least One Leadership Piece Staying In Seattle As Alex Carpenter Becomes First Protected Player Yahoo Sports || Yahoo Sports Canada (Strong): PWHL Free Agency And Expansion Signing Tracker
