post_sequence,headline,action,editorial_decision,content_family,template_name,asset_shape,timing,context_source_status,context_confidence,manual_review_flag,story_summary,key_fact_1,key_fact_2,key_fact_3,final_score,key_number,main_takeaway,supplemental_source_count,supplemental_sources,caption,image_generation_prompt
1,"Gauff wins third career WTA 1000 title, ends Pegula’s impressive run in Wuhan",Make and post first,Must Post,Postgame Recap,Postgame Recap Card,4-slide 4:5 carousel,Post ASAP,supplemental_search,High,No,"Gauff wins third career WTA 1000 title, ends Pegula's impressive run in Wuhan","Gauff wins third career WTA 1000 title, ends Pegula's impressive run in Wuhan","Gauff wins third career WTA 1000 title, ends Pegula's impressive run in Wuhan WTA Tennis",Coco Gauff takes confidence from Wuhan triumph ahead of WTA Finals title defence,,,"Gauff wins third career WTA 1000 title, ends Pegula's impressive run in Wuhan WTA Tennis",5,"WTA Tennis (Official): Gauff wins third career WTA 1000 title, ends Pegula's impressive run in Wuhan || WTA Tennis (Official): Gauff wins third career WTA 1000 title, ends Pegula's impressive run in Wuhan WTA Tennis || The Straits Times (Other): Coco Gauff takes confidence from Wuhan triumph ahead of WTA Finals title defence || The Straits Times (Other): Coco Gauff takes confidence from Wuhan triumph ahead of WTA Finals title defence The Straits Times || WTA Tennis (Official): Wuhan Open 2026 Scores | Latest Scores & Live Updates","Gauff wins third career WTA 1000 title, ends Pegula’s impressive run in Wuhan Here is the quick version of what happened and why it matters. Why it matters: This is timely Tennis coverage with a result fans may want explained quickly. Swipe through for the quick breakdown. #WomensSports #HerSportsDaily #SportsNews #WTA #Tennis","Create a 4-slide 4:5 Instagram carousel for Her Sports Daily. Template style: Postgame Recap Card. Sport: Tennis. Content family: Postgame Recap. Use a bold editorial women's sports aesthetic with strong hierarchy. Slide 1 headline: 'Gauff wins third career WTA 1000 title, ends Pegula’s impressive run in Wuhan'. Slide 2 title: 'Why it matters' with body: 'This is timely Tennis coverage with a result fans may want explained quickly.'. Slide 3 title: 'The angle' with body: 'What happened, who stood out, and why it matters for Tennis fans.'. Slide 4 title: 'Your take?' with a short CTA to comment and follow Her Sports Daily. Use recap structure, outcome first, top performer callout, and one takeaway panel."
2,"A’ja Wilson scores 32 points, Chelsea Gray ties WNBA record with 9 3-pointers, Aces beat Fire 105-89",Make and post second,Must Post,Tonight in the W,Tonight in the W,4-slide 4:5 carousel,Post ASAP,supplemental_search,Medium,Yes,"A'ja Wilson scores 32 points, Chelsea Gray ties WNBA record with 9 3-pointers, Aces beat Fire 105-89","A'ja Wilson scores 32 points, Chelsea Gray ties WNBA record with 9 3-pointers, Aces beat Fire 105-89","A'ja Wilson scores 32 points, Chelsea Gray ties WNBA record with 9 3-pointers, Aces beat Fire 105-89 iNFOnews.ca","Wilson scores 32 points, Gray ties WNBA record with nine 3-pointers as Aces beat Fire",105-89,32 points,"A'ja Wilson scores 32 points, Chelsea Gray ties WNBA record with 9 3-pointers, Aces beat Fire 105-89 iNFOnews.ca",5,"iNFOnews.ca (Other): A'ja Wilson scores 32 points, Chelsea Gray ties WNBA record with 9 3-pointers, Aces beat Fire 105-89 || iNFOnews.ca (Other): A'ja Wilson scores 32 points, Chelsea Gray ties WNBA record with 9 3-pointers, Aces beat Fire 105-89 iNFOnews.ca || TSN (Other): Wilson scores 32 points, Gray ties WNBA record with nine 3-pointers as Aces beat Fire || TSN (Other): Wilson scores 32 points, Gray ties WNBA record with nine 3-pointers as Aces beat Fire TSN || MSN (Other): Gray ties WNBA 3-point record as Aces beat Fire","A’ja Wilson scores 32 points, Chelsea Gray ties WNBA record with 9 3-pointers, Aces beat Fire 105-89 This is the kind of milestone that shows where the game is headed. Why it matters: Records and milestones are proof points for the rise of women's sports. Swipe through for the quick breakdown. #WomensSports #HerSportsDaily #SportsNews #WNBA #WomensBasketball","Create a 4-slide 4:5 Instagram carousel for Her Sports Daily. Template style: Tonight in the W. Sport: WNBA. Content family: Tonight in the W. Use a bold editorial women's sports aesthetic with strong hierarchy. Slide 1 headline: 'A’ja Wilson scores 32 points, Chelsea Gray ties WNBA record with 9 3-pointers, Aces beat'. Slide 2 title: 'Why it matters' with body: 'Records and milestones are proof points for the rise of women's sports.'. Slide 3 title: 'The angle' with body: 'A milestone worth putting into context.'. Slide 4 title: 'Your take?' with a short CTA to comment and follow Her Sports Daily. Use energetic sports graphic styling, matchup emphasis, strong hierarchy, top-left watermark safe zone, and clear CTA."
3,GAME RECAP: Record 3-Point Shooting by Chelsea Gray Helps Aces Douse Fire 105-89,Make and post third,Maybe Post,Tonight in the W,Tonight in the W,4-slide 4:5 carousel,Use when convenient,fallback_summary,Medium,Yes,GAME RECAP: Record 3-Point Shooting by Chelsea Gray Helps Aces Douse Fire 105-89 Las Vegas Aces.,GAME RECAP: Record 3-Point Shooting by Chelsea Gray Helps Aces Douse Fire 105-89 Las Vegas Aces.,,,105-89,Record 3,Milestone is headline-confirmed. Verify exact record details before adding supporting stats.,0,,GAME RECAP: Record 3-Point Shooting by Chelsea Gray Helps Aces Douse Fire 105-89 This is the kind of milestone that shows where the game is headed. Why it matters: Records and milestones are proof points for the rise of women's sports. Swipe through for the quick breakdown. #WomensSports #HerSportsDaily #SportsNews #WNBA #WomensBasketball,"Create a 4-slide 4:5 Instagram carousel for Her Sports Daily. Template style: Tonight in the W. Sport: WNBA. Content family: Tonight in the W. Use a bold editorial women's sports aesthetic with strong hierarchy. Slide 1 headline: 'GAME RECAP: Record 3-Point Shooting by Chelsea Gray Helps Aces Douse Fire 105-89'. Slide 2 title: 'Why it matters' with body: 'Records and milestones are proof points for the rise of women's sports.'. Slide 3 title: 'The angle' with body: 'A milestone worth putting into context.'. Slide 4 title: 'Your take?' with a short CTA to comment and follow Her Sports Daily. Use energetic sports graphic styling, matchup emphasis, strong hierarchy, top-left watermark safe zone, and clear CTA."
4,Looking At What Each Of The PWHL's Expansion Teams Needs Most In Phase Four,Make if time today,Maybe Post,Growth of the Game,Growth Carousel,4-slide 4:5 carousel,Post during daytime engagement window,supplemental_search,Medium,Yes,Looking At What Each Of The PWHL's Expansion Teams Needs Most In Phase Four,Looking At What Each Of The PWHL's Expansion Teams Needs Most In Phase Four,Looking At What Each Of The PWHL's Expansion Teams Needs Most In Phase Four Yahoo Sports Canada,Looking At What Each Of The PWHL's Expansion Teams Needs Most In Phase Four The Hockey News,,,Looking At What Each Of The PWHL's Expansion Teams Needs Most In Phase Four Yahoo Sports Canada,3,Yahoo Sports Canada (Strong): Looking At What Each Of The PWHL's Expansion Teams Needs Most In Phase Four || Yahoo Sports Canada (Strong): Looking At What Each Of The PWHL's Expansion Teams Needs Most In Phase Four Yahoo Sports Canada || The Hockey News (Other): Looking At What Each Of The PWHL's Expansion Teams Needs Most In Phase Four The Hockey News,Looking At What Each Of The PWHL's Expansion Teams Needs Most In Phase Four Another market is betting big on women's sports. Why it matters: Expansion stories show where fan demand and investor confidence are rising. Swipe through for the quick breakdown. #WomensSports #HerSportsDaily #SportsNews #PWHL #WomensHockey,"Create a 4-slide 4:5 Instagram carousel for Her Sports Daily. Template style: Growth Carousel. Sport: PWHL / Women's Hockey. Content family: Growth of the Game. Use a bold editorial women's sports aesthetic with strong hierarchy. Slide 1 headline: 'Looking At What Each Of The PWHL's Expansion Teams Needs Most In Phase Four'. Slide 2 title: 'Why it matters' with body: 'Expansion stories show where fan demand and investor confidence are rising.'. Slide 3 title: 'The angle' with body: 'Another sign that women's sports demand is outgrowing the old model.'. Slide 4 title: 'Your take?' with a short CTA to comment and follow Her Sports Daily. Use clean editorial design, stat-forward layout, strong number hierarchy, and easy-to-read supporting text."
5,Georgia's Adaejah Hodge breaks Sha'Carri Richardson's 100 meter NCAA record,Make if time today,Maybe Post,Milestone Card,Milestone Graphic,single 4:5 feed card,Use when convenient,supplemental_search,High,No,Georgia's Adaejah Hodge breaks Sha'Carri Richardson's 100 meter NCAA record,Georgia's Adaejah Hodge breaks Sha'Carri Richardson's 100 meter NCAA record,Georgia's Adaejah Hodge breaks Sha'Carri Richardson's 100 meter NCAA record NCAA.com,Adaejah Hodge Breaks Sha'Carri Richardson's NCAA 100m Record,,100,Georgia's Adaejah Hodge breaks Sha'Carri Richardson's 100 meter NCAA record NCAA.com,5,NCAA.com (Official): Georgia's Adaejah Hodge breaks Sha'Carri Richardson's 100 meter NCAA record || NCAA.com (Official): Georgia's Adaejah Hodge breaks Sha'Carri Richardson's 100 meter NCAA record NCAA.com || FloTrack (Other): Adaejah Hodge Breaks Sha'Carri Richardson's NCAA 100m Record || FloTrack (Other): Adaejah Hodge Breaks Sha'Carri Richardson's NCAA 100m Record FloTrack || LetsRun.com (Other): Georgia's Adaejah Hodge DESTROYS Sha'Carri Richardson's NCAA 100m record,Georgia's Adaejah Hodge breaks Sha'Carri Richardson's 100 meter NCAA record This is the kind of milestone that shows where the game is headed. Why it matters: Records and milestones are proof points for the rise of women's sports. Swipe through for the quick breakdown. #WomensSports #HerSportsDaily #SportsNews #TrackAndField,"Create a single 4:5 Instagram feed graphic for Her Sports Daily. Template style: Milestone Graphic. Sport: Track & Field. Content family: Milestone Card. Main headline: 'Georgia's Adaejah Hodge breaks Sha'Carri Richardson's 100 meter NCAA record'. Supporting line: 'Records and milestones are proof points for the rise of women's sports.'. Include a short footer CTA such as 'More women's sports daily'. Use a clean modern sports editorial look. Use athlete hero image, big milestone number or phrase, and one concise context line."
6,Former UCLA Softball Star Megan Grant Crushes Record Homer in AUSL Debut,Save for weekend,Save for Weekend,Milestone Card,Milestone Graphic,single 4:5 feed card,Save for weekend or filler slot,direct_article_plus_supplemental_search,High,No,"Former UCLA Softball Star Megan Grant Crushes Record Homer in AUSL Debut UCLA product Megan Grant launched a 313-foot home run for the Portland Cascade, setting an AUSL record in her professional roster debut.","Former UCLA Softball Star Megan Grant Crushes Record Homer in AUSL Debut UCLA product Megan Grant launched a 313-foot home run for the Portland Cascade, setting an AUSL record in her professional roster debut.","Former UCLA softball standout Megan Grant wasted no time making her mark in the pros, setting a new AUSL record for the longest home run in league history during her first week with the Portland Cascade.","With her first professional home run, Megan Grant just set @theAUSLofficial record for longest homer!",,313,"Former UCLA softball standout Megan Grant wasted no time making her mark in the pros, setting a new AUSL record for the longest home run in league history during her first week with the Portland Cascade.",5,Just Women's Sports (Strong): Former UCLA Softball Star Megan Grant Crushes Record Homer in AUSL Debut || Just Women's Sports (Strong): Former UCLA Softball Star Megan Grant Crushes Record Homer in AUSL Debut Just Women's Sports || Los Angeles Times (Other): Megan Grant becomes UCLA's all-time home run leader in win over Arkansas at WCWS || Los Angeles Times (Other): Megan Grant becomes UCLA's all-time home run leader in win over Arkansas at WCWS Los Angeles Times || Just Women's Sports (Strong): Former UCLA Softball Star Maya Brady Selected No. 1 Overall in AUSL Expansion Draft,Former UCLA Softball Star Megan Grant Crushes Record Homer in AUSL Debut This is the kind of milestone that shows where the game is headed. Why it matters: Records and milestones are proof points for the rise of women's sports. Swipe through for the quick breakdown. #WomensSports #HerSportsDaily #SportsNews #Softball #WCWS,"Create a single 4:5 Instagram feed graphic for Her Sports Daily. Template style: Milestone Graphic. Sport: Softball. Content family: Milestone Card. Main headline: 'Former UCLA Softball Star Megan Grant Crushes Record Homer in AUSL Debut'. Supporting line: 'Records and milestones are proof points for the rise of women's sports.'. Include a short footer CTA such as 'More women's sports daily'. Use a clean modern sports editorial look. Use athlete hero image, big milestone number or phrase, and one concise context line."
7,"Abby Wambach, USWNT Legends Join Crux Football’s Player Investor Collective",Save for weekend,Save for Weekend,Growth of the Game,Growth Carousel,4-slide 4:5 carousel,Post during daytime engagement window,direct_article_plus_supplemental_search,High,No,"Abby Wambach, USWNT Legends Join Crux Football's Player Investor Collective Abby Wambach headlined the women's soccer legends joining multi-team ownership group Crux Football's Player Investor Collective this week.","Abby Wambach, USWNT Legends Join Crux Football's Player Investor Collective Abby Wambach headlined the women's soccer legends joining multi-team ownership group Crux Football's Player Investor Collective this week.","Three women's soccer greats are buying in, as retired USWNT stars Abby Wambach , Julie Foudy, and Leslie Osborne joined multi-club ownership group Crux Football's new Player Investor Collective .","Victoria Mboko Queen's Club Injury Threatens Serena Williams Comeback Run By clicking ""Accept"", you agree to the storing of cookies on your device",,,"Three women's soccer greats are buying in, as retired USWNT stars Abby Wambach , Julie Foudy, and Leslie Osborne joined multi-club ownership group Crux Football's new Player Investor Collective .",2,"Just Women's Sports (Strong): Abby Wambach, USWNT Legends Join Crux Football's Player Investor Collective || Just Women's Sports (Strong): Abby Wambach, USWNT Legends Join Crux Football's Player Investor Collective Just Women's Sports","Abby Wambach, USWNT Legends Join Crux Football’s Player Investor Collective Women's sports are becoming impossible for the business world to ignore. Why it matters: This helps show the business momentum behind women's sports. Swipe through for the quick breakdown. #WomensSports #HerSportsDaily #SportsNews #NWSL #USWNT #WomensSoccer","Create a 4-slide 4:5 Instagram carousel for Her Sports Daily. Template style: Growth Carousel. Sport: NWSL / Women's Soccer. Content family: Growth of the Game. Use a bold editorial women's sports aesthetic with strong hierarchy. Slide 1 headline: 'Abby Wambach, USWNT Legends Join Crux Football’s Player Investor Collective'. Slide 2 title: 'Why it matters' with body: 'This helps show the business momentum behind women's sports.'. Slide 3 title: 'The angle' with body: 'The business of women's sports is not emerging anymore. It is becoming big business.'. Slide 4 title: 'Your take?' with a short CTA to comment and follow Her Sports Daily. Use clean editorial design, stat-forward layout, strong number hierarchy, and easy-to-read supporting text."
8,Gotham FC announces first-ever ‘dedicated’ training facility,Save for weekend,Save for Weekend,Milestone Card,Milestone Graphic,single 4:5 feed card,Save for weekend or filler slot,supplemental_search,Medium,Yes,"Gotham FC to construct $35 million training facility, a first for the club: ‘This is absolutely huge'","Gotham FC to construct $35 million training facility, a first for the club: ‘This is absolutely huge'","Gotham FC to construct $35 million training facility, a first for the club: ‘This is absolutely huge' Yahoo Sports",Club History: Denver Summit FC takes down defending NWSL Champions NJ/NY Gotham 2-0 for their first ever win,2-0,,"Gotham FC to construct $35 million training facility, a first for the club: ‘This is absolutely huge' Yahoo Sports",5,"Yahoo Sports (Strong): Gotham FC to construct $35 million training facility, a first for the club: ‘This is absolutely huge' || Yahoo Sports (Strong): Gotham FC to construct $35 million training facility, a first for the club: ‘This is absolutely huge' Yahoo Sports || All For XI (Other): Club History: Denver Summit FC takes down defending NWSL Champions NJ/NY Gotham 2-0 for their first ever win || All For XI (Other): Club History: Denver Summit FC takes down defending NWSL Champions NJ/NY Gotham 2-0 for their first ever win All For XI || Yahoo Sports (Strong): Gotham FC announces dedicated training facility",Gotham FC announces first-ever ‘dedicated’ training facility This is the kind of milestone that shows where the game is headed. Why it matters: Records and milestones are proof points for the rise of women's sports. Swipe through for the quick breakdown. #WomensSports #HerSportsDaily #SportsNews #NWSL #USWNT #WomensSoccer,"Create a single 4:5 Instagram feed graphic for Her Sports Daily. Template style: Milestone Graphic. Sport: NWSL / Women's Soccer. Content family: Milestone Card. Main headline: 'Gotham FC announces first-ever ‘dedicated’ training facility'. Supporting line: 'Records and milestones are proof points for the rise of women's sports.'. Include a short footer CTA such as 'More women's sports daily'. Use a clean modern sports editorial look. Use athlete hero image, big milestone number or phrase, and one concise context line."
