post_id,post_date,bundle_name,content_pillar,post_format,publish_time_local,reach,impressions,accounts_engaged,likes,comments,saves,shares,follows,profile_visits,caption_hook,creative_notes,source_run,notes
01_tonight_in_the_w_preview_1080x1350,,Tonight in the W Preview,WNBA Roundup,4-slide carousel,,,,,,,,,,,"Tonight in the W: Connecticut Sun at Toronto Tempo - wed, june 10th at 7:00 pm edt | Los Angeles Sparks at Seattle Storm - wed, june 10th at 10:00 pm edt",,hsd-launch-control-v1.1.2,
01_main_wnba_result_1080x1350,,Main WNBA Result,WNBA Lead,4-slide carousel,,,,,,,,,,,"Dallas Wings beat Los Angeles Sparks. Top performers: Jessica Shepard (Dallas Wings): PTS 22, REB 15, AST 5, STL 2; Arike Ogunbowale (Dallas Wings): PTS 30, REB",,hsd-launch-control-v1.1,
02_tonight_in_the_w_mini_roundup_1080x1350,,Tonight in the W Mini-Roundup,WNBA Roundup,5-slide carousel,,,,,,,,,,,"Tonight in the W roundup: Las Vegas Aces beat Golden State Valkyries: Las Vegas Aces 84, Golden State Valkyries 79 | Minnesota Lynx beat Seattle Storm: Minnesot",,hsd-launch-control-v1.1,
03_volleyball_results_roundup_1080x1350,,Volleyball Results Roundup,Volleyball,5-slide carousel,,,,,,,,,,,Around Women’s Sports volleyball radar: USA W beat France W: USA W 3 - France W 2 | Belgium W beat Thailand W: Belgium W 3 - Thailand W 2 | Brazil W beat Bulgar,,hsd-launch-control-v1.1,
04_women_s_soccer_radar_1080x1350,,Women's Soccer Radar,Women's Soccer,5-slide carousel,,,,,,,,,,,Women’s soccer radar: Brazil U20 W beat Korea Republic U20 W: Brazil U20 W 3 - Korea Republic U20 W 0 | Brazil W beat USA W: Brazil W 2 - USA W 1 | Japan W beat,,hsd-launch-control-v1.1,
