post_sequence,headline,action,editorial_decision,content_family,template_name,asset_shape,timing,context_source_status,context_confidence,manual_review_flag,story_summary,key_fact_1,key_fact_2,key_fact_3,final_score,key_number,main_takeaway,supplemental_source_count,supplemental_sources,caption,image_generation_prompt
1,"Nelly Korda wins U.S. Women's Open title with perilous final putt, claiming her 2nd straight major",Make and post first,Must Post,Postgame Recap,Postgame Recap Card,4-slide 4:5 carousel,Post ASAP,supplemental_search,Medium,Yes,"Nelly Korda wins U.S. Women's Open title with perilous final putt, claiming her 2nd straight major","Nelly Korda wins U.S. Women's Open title with perilous final putt, claiming her 2nd straight major","Nelly Korda wins US Women's Open title with perilous final putt, claiming her 2nd straight major MSN","US Women's Open: Nelly Korda wins title with perilous final putt, claiming her 2nd straight major",,,"Nelly Korda wins US Women's Open title with perilous final putt, claiming her 2nd straight major MSN",5,"AP News (Strong): Nelly Korda wins U.S. Women's Open title with perilous final putt, claiming her 2nd straight major || MSN (Other): Nelly Korda wins US Women's Open title with perilous final putt, claiming her 2nd straight major MSN || Chicago Tribune (Other): US Women's Open: Nelly Korda wins title with perilous final putt, claiming her 2nd straight major || Chicago Tribune (Other): US Women's Open: Nelly Korda wins title with perilous final putt, claiming her 2nd straight major Chicago Tribune || Toronto Star (Other): Korda wins U.S. Women's Open title with perilous final putt, claiming 2nd straight major","Nelly Korda wins U.S. Women's Open title with perilous final putt, claiming her 2nd straight major Here is the quick version of what happened and why it matters. Why it matters: This is timely Golf / LPGA coverage with a result fans may want explained quickly. Swipe through for the quick breakdown. #WomensSports #HerSportsDaily #SportsNews #LPGA #Golf","Create a 4-slide 4:5 Instagram carousel for Her Sports Daily. Template style: Postgame Recap Card. Sport: Golf / LPGA. Content family: Postgame Recap. Use a bold editorial women's sports aesthetic with strong hierarchy. Slide 1 headline: 'Nelly Korda wins U.S. Women's Open title with perilous final putt, claiming her 2nd'. Slide 2 title: 'Why it matters' with body: 'This is timely Golf / LPGA coverage with a result fans may want explained quickly.'. Slide 3 title: 'The angle' with body: 'What happened, who stood out, and why it matters for Golf / LPGA fans.'. Slide 4 title: 'Your take?' with a short CTA to comment and follow Her Sports Daily. Use recap structure, outcome first, top performer callout, and one takeaway panel."
2,"A’ja Wilson, Caitlin Clark, and Top Rookies Shatter WNBA Records 1 Month Into 2026",Make and post second,Must Post,Tonight in the W,Tonight in the W,4-slide 4:5 carousel,Post ASAP,direct_article_text,High,No,Fever superstar Caitlin Clark averaged 8.5 assists per game over the course of her career — that's 1.8 more than anyone in WNBA history.,Fever superstar Caitlin Clark averaged 8.5 assists per game over the course of her career — that's 1.8 more than anyone in WNBA history.,"Through the first month, Minnesota rookie Olivia Miles leads all rookies in points, assists, and steals.","We're just about one month into the 2026 WNBA season , and already A'ja Wilson has added to the record books, a couple rookies have gotten off to historic starts, and the Indiana Fever is playing at a breakneck speed.",,8,"Through the first month, Minnesota rookie Olivia Miles leads all rookies in points, assists, and steals.",0,,"A’ja Wilson, Caitlin Clark, and Top Rookies Shatter WNBA Records 1 Month Into 2026 This is the kind of milestone that shows where the game is headed. Why it matters: Records and milestones are proof points for the rise of women's sports. Swipe through for the quick breakdown. #WomensSports #HerSportsDaily #SportsNews #WNBA #WomensBasketball","Create a 4-slide 4:5 Instagram carousel for Her Sports Daily. Template style: Tonight in the W. Sport: WNBA. Content family: Tonight in the W. Use a bold editorial women's sports aesthetic with strong hierarchy. Slide 1 headline: 'A’ja Wilson, Caitlin Clark, and Top Rookies Shatter WNBA Records 1 Month Into 2026'. Slide 2 title: 'Why it matters' with body: 'Records and milestones are proof points for the rise of women's sports.'. Slide 3 title: 'The angle' with body: 'A milestone worth putting into context.'. Slide 4 title: 'Your take?' with a short CTA to comment and follow Her Sports Daily. Use energetic sports graphic styling, matchup emphasis, strong hierarchy, top-left watermark safe zone, and clear CTA."
3,WNBA gameday discussion: Can the Toronto Tempo and Portland Fire earn their first-ever Commissioner’s Cup wins?,Make and post third,Maybe Post,Tonight in the W,Tonight in the W,4-slide 4:5 carousel,Post within 2 hours if still fresh,supplemental_search,Medium,Yes,WNBA gameday discussion: Can the Toronto Tempo and Portland Fire earn their first-ever Commissioner's Cup wins?,WNBA gameday discussion: Can the Toronto Tempo and Portland Fire earn their first-ever Commissioner's Cup wins?,WNBA gameday discussion: Does defense win Commissioner's Cup championships? These teams hope so,WNBA gameday discussion: Does defense win Commissioner's Cup championships?,,,WNBA gameday discussion: Does defense win Commissioner's Cup championships? These teams hope so,5,Swish Appeal (Strong): WNBA gameday discussion: Can the Toronto Tempo and Portland Fire earn their first-ever Commissioner's Cup wins? || Swish Appeal (Strong): WNBA gameday discussion: Does defense win Commissioner's Cup championships? These teams hope so || Swish Appeal (Strong): WNBA gameday discussion: Does defense win Commissioner's Cup championships? || Swish Appeal (Strong): WNBA gameday discussion: Here are the stakes of Valkyries-Aces and all of Saturday's Commissioner's Cup contests || Swish Appeal (Strong): WNBA gameday discussion: Here are the stakes of Valkyries-Aces and all of Saturday's Commissioner's Cup contests Swish Appeal,WNBA gameday discussion: Can the Toronto Tempo and Portland Fire earn their first-ever Commissioner’s Cup wins? Here is the quick version of what happened and why it matters. Why it matters: This is timely WNBA coverage with a result fans may want explained quickly. Swipe through for the quick breakdown. #WomensSports #HerSportsDaily #SportsNews #WNBA #WomensBasketball,"Create a 4-slide 4:5 Instagram carousel for Her Sports Daily. Template style: Tonight in the W. Sport: WNBA. Content family: Tonight in the W. Use a bold editorial women's sports aesthetic with strong hierarchy. Slide 1 headline: 'WNBA gameday discussion: Can the Toronto Tempo and Portland Fire earn their first-ever'. Slide 2 title: 'Why it matters' with body: 'This is timely WNBA coverage with a result fans may want explained quickly.'. Slide 3 title: 'The angle' with body: 'What happened, who stood out, and why it matters for WNBA fans.'. Slide 4 title: 'Your take?' with a short CTA to comment and follow Her Sports Daily. Use energetic sports graphic styling, matchup emphasis, strong hierarchy, top-left watermark safe zone, and clear CTA."
4,PWHL Las Vegas signs first-ever players ahead of inaugural season,Make if time today,Maybe Post,Milestone Card,Milestone Graphic,single 4:5 feed card,Use when convenient,supplemental_search,Medium,Yes,PWHL Las Vegas signs first-ever players ahead of inaugural season,PWHL Las Vegas signs first-ever players ahead of inaugural season,PWHL Las Vegas signs first-ever players ahead of inaugural season AOL.com,PWHL ROOKIE OF THE YEAR SARAH FILLIER SIGNS A TWO–YEAR EXTENSION WITH NEW YORK,,,PWHL Las Vegas signs first-ever players ahead of inaugural season AOL.com,5,AOL.com (Other): PWHL Las Vegas signs first-ever players ahead of inaugural season || AOL.com (Other): PWHL Las Vegas signs first-ever players ahead of inaugural season AOL.com || Professional Women's Hockey League (PWHL) (Other): PWHL ROOKIE OF THE YEAR SARAH FILLIER SIGNS A TWO–YEAR EXTENSION WITH NEW YORK || Professional Women's Hockey League (PWHL) (Other): PWHL ROOKIE OF THE YEAR SARAH FILLIER SIGNS A TWO–YEAR EXTENSION WITH NEW YORK Professional Women's Hockey League (PWHL) || Yahoo Sports (Strong): Las Vegas Signs Kendall Cooper And Mae Batherson As First Ever Players,PWHL Las Vegas signs first-ever players ahead of inaugural season This is the kind of milestone that shows where the game is headed. Why it matters: Records and milestones are proof points for the rise of women's sports. Swipe through for the quick breakdown. #WomensSports #HerSportsDaily #SportsNews #PWHL #WomensHockey,"Create a single 4:5 Instagram feed graphic for Her Sports Daily. Template style: Milestone Graphic. Sport: PWHL / Women's Hockey. Content family: Milestone Card. Main headline: 'PWHL Las Vegas signs first-ever players ahead of inaugural season'. Supporting line: 'Records and milestones are proof points for the rise of women's sports.'. Include a short footer CTA such as 'More women's sports daily'. Use a clean modern sports editorial look. Use athlete hero image, big milestone number or phrase, and one concise context line."
5,Reese Atwood Caps Texas Career with Back-to-Back WCWS Championships,Make if time today,Maybe Post,Milestone Card,Milestone Graphic,single 4:5 feed card,Use when convenient,direct_article_plus_supplemental_search,High,No,Reese Atwood Caps Texas Career with Back-to-Back WCWS Championships Texas softball legend Reese Atwood crowns her historic career with a second straight WCWS national championship before heading to the AUSL.,Reese Atwood Caps Texas Career with Back-to-Back WCWS Championships Texas softball legend Reese Atwood crowns her historic career with a second straight WCWS national championship before heading to the AUSL.,"Texas softball are back-to-back national champions, after the Longhorns defeated Texas Tech 4-1 on Thursday to clinch a second consecutive Women's College World Series title in Oklahoma City.","She's been an inspiration to everybody including myself."" Now, with her college career capped, Atwood is headed to the pros.",4-1,2025,"Texas softball are back-to-back national champions, after the Longhorns defeated Texas Tech 4-1 on Thursday to clinch a second consecutive Women's College World Series title in Oklahoma City.",5,Just Women's Sports (Strong): Reese Atwood Caps Texas Career with Back-to-Back WCWS Championships || Just Women's Sports (Strong): Reese Atwood Caps Texas Career with Back-to-Back WCWS Championships Just Women's Sports || Just Women's Sports (Strong): Texas Scores First-Ever NCAA Softball Championship as 2025 WCWS Breaks Records || Just Women's Sports (Strong): Texas Scores First-Ever NCAA Softball Championship as 2025 WCWS Breaks Records Just Women's Sports || San Antonio Express-News (Other): O'Connor graduate Leighann Goode caps Texas career with second national title,Reese Atwood Caps Texas Career with Back-to-Back WCWS Championships This is the kind of milestone that shows where the game is headed. Why it matters: Records and milestones are proof points for the rise of women's sports. Swipe through for the quick breakdown. #WomensSports #HerSportsDaily #SportsNews #Softball #WCWS,"Create a single 4:5 Instagram feed graphic for Her Sports Daily. Template style: Milestone Graphic. Sport: Softball. Content family: Milestone Card. Main headline: 'Reese Atwood Caps Texas Career with Back-to-Back WCWS Championships'. Supporting line: 'Records and milestones are proof points for the rise of women's sports.'. Include a short footer CTA such as 'More women's sports daily'. Use a clean modern sports editorial look. Use athlete hero image, big milestone number or phrase, and one concise context line."
6,"Indiana Fever vs. New York Liberty - Final Score - June 06, 2026",Make if time today,Maybe Post,Tonight in the W,Tonight in the W,4-slide 4:5 carousel,Post within 2 hours if still fresh,supplemental_search,Medium,Yes,"Indiana Fever vs. New York Liberty Live Score and Stats - June 6, 2026 Gametracker","Indiana Fever vs. New York Liberty Live Score and Stats - June 6, 2026 Gametracker",How many points did Caitlin Clark score tonight in Indiana Fever vs New York Liberty?,"Indiana Fever, Caitlin Clark vs New York Liberty score updates: Fever fade under pressure from Liberty",,,How many points did Caitlin Clark score tonight in Indiana Fever vs New York Liberty?,5,"CBS Sports (Strong): Indiana Fever vs. New York Liberty Live Score and Stats - June 6, 2026 Gametracker || IndyStar (Other): How many points did Caitlin Clark score tonight in Indiana Fever vs New York Liberty? || IndyStar (Other): Indiana Fever, Caitlin Clark vs New York Liberty score updates: Fever fade under pressure from Liberty || IndyStar (Other): Indiana Fever, Caitlin Clark vs New York Liberty score updates: Fever fade under pressure from Liberty IndyStar || The New York Times (Other): Liberty's Breanna Stewart scores 30, helps New York rally past Indiana Fever - The Athletic","Indiana Fever vs. New York Liberty - Final Score - June 06, 2026 Here is the quick version of what happened and why it matters. Why it matters: This is timely WNBA coverage with a result fans may want explained quickly. Swipe through for the quick breakdown. #WomensSports #HerSportsDaily #SportsNews #WNBA #WomensBasketball","Create a 4-slide 4:5 Instagram carousel for Her Sports Daily. Template style: Tonight in the W. Sport: WNBA. Content family: Tonight in the W. Use a bold editorial women's sports aesthetic with strong hierarchy. Slide 1 headline: 'Indiana Fever vs. New York Liberty - Final Score - June 06, 2026'. Slide 2 title: 'Why it matters' with body: 'This is timely WNBA coverage with a result fans may want explained quickly.'. Slide 3 title: 'The angle' with body: 'What happened, who stood out, and why it matters for WNBA fans.'. Slide 4 title: 'Your take?' with a short CTA to comment and follow Her Sports Daily. Use energetic sports graphic styling, matchup emphasis, strong hierarchy, top-left watermark safe zone, and clear CTA."
7,UCLA women’s basketball signs Slovenian guard Lina Jerkovic,Save for weekend,Save for Weekend,Standard Feed,Standard Feed Card,single 4:5 feed card,Save for weekend or filler slot,supplemental_search,Medium,Yes,UCLA women's basketball signs Slovenian guard Lina Jerkovic,UCLA women's basketball signs Slovenian guard Lina Jerkovic,UCLA women's basketball signs Slovenian guard Lina Jerkovic Yahoo Sports,UCLA women's basketball signs Slovenian guard Lina Jerkovic New York Post,,,UCLA women's basketball signs Slovenian guard Lina Jerkovic Yahoo Sports,5,Yahoo Sports (Strong): UCLA women's basketball signs Slovenian guard Lina Jerkovic || Yahoo Sports (Strong): UCLA women's basketball signs Slovenian guard Lina Jerkovic Yahoo Sports || New York Post (Other): UCLA women's basketball signs Slovenian guard Lina Jerkovic New York Post || Yahoo Sports (Strong): UCLA Women's Basketball Adds Second Freshman to Roster || Yahoo Sports (Strong): UCLA Women's Basketball Adds Second Freshman to Roster Yahoo Sports,"UCLA women’s basketball signs Slovenian guard Lina Jerkovic UCLA women’s basketball signs Slovenian guard Lina Jerkovic Why it matters: This is a useful update, but it should be weighed against stronger stories. Swipe through for the quick breakdown. #WomensSports #HerSportsDaily #SportsNews #NCAAWBB #WomensBasketball","Create a single 4:5 Instagram feed graphic for Her Sports Daily. Template style: Standard Feed Card. Sport: NCAA Women's Basketball. Content family: Standard Feed. Main headline: 'UCLA women’s basketball signs Slovenian guard Lina Jerkovic'. Supporting line: 'This is a useful update, but it should be weighed against stronger stories.'. Include a short footer CTA such as 'More women's sports daily'. Use a clean modern sports editorial look. Use simple clean headline card with one supporting line and brand bug."
8,Toronto Sceptres Pushing Through Expansion Process,Save for weekend,Save for Weekend,Growth of the Game,Growth Carousel,4-slide 4:5 carousel,Post during daytime engagement window,supplemental_search,Medium,Yes,Toronto Sceptres Pushing Through Expansion Process,Toronto Sceptres Pushing Through Expansion Process,Toronto Sceptres Pushing Through Expansion Process The IX Sports,How The Toronto Sceptres Could Force Changes To The PWHL's Expansion Plans,,,Toronto Sceptres Pushing Through Expansion Process The IX Sports,4,The IX Sports (Other): Toronto Sceptres Pushing Through Expansion Process || The IX Sports (Other): Toronto Sceptres Pushing Through Expansion Process The IX Sports || Yahoo Sports Canada (Strong): How The Toronto Sceptres Could Force Changes To The PWHL's Expansion Plans || Yahoo Sports Canada (Strong): How The Toronto Sceptres Could Force Changes To The PWHL's Expansion Plans Yahoo Sports Canada,Toronto Sceptres Pushing Through Expansion Process Another market is betting big on women's sports. Why it matters: Expansion stories show where fan demand and investor confidence are rising. Swipe through for the quick breakdown. #WomensSports #HerSportsDaily #SportsNews #PWHL #WomensHockey,"Create a 4-slide 4:5 Instagram carousel for Her Sports Daily. Template style: Growth Carousel. Sport: PWHL / Women's Hockey. Content family: Growth of the Game. Use a bold editorial women's sports aesthetic with strong hierarchy. Slide 1 headline: 'Toronto Sceptres Pushing Through Expansion Process'. Slide 2 title: 'Why it matters' with body: 'Expansion stories show where fan demand and investor confidence are rising.'. Slide 3 title: 'The angle' with body: 'Another sign that women's sports demand is outgrowing the old model.'. Slide 4 title: 'Your take?' with a short CTA to comment and follow Her Sports Daily. Use clean editorial design, stat-forward layout, strong number hierarchy, and easy-to-read supporting text."
